song,artist,url,lyrics,year
Treasure,The Cure,https://www.azlyrics.com/lyrics/cure/treasure.html,"She whispers
""please remember me
When I am gone from here""
She whispers
""please remember me
But not with tears...
Remember I was always true
Remember that I always tried
Remember I loved only you
Remember me and smile...
For it's better to forget
Than to remember me
And cry""

""remember I was always true
Remember that I always tried
Remember I loved only you
Remember me and smile...
For it's better to forget
Than to remember me
And cry... """,1996
Touched,Vast,https://www.azlyrics.com/lyrics/vast/touched.html,"Touched
You say that I am too
So much of what you say is true

I'll never find someone quite like you again
I'll never find someone quite like you, like you

The razors and the dying roses
Plead I don't leave you alone
The demi-gods and hungry ghosts
God, god knows I'm not at home

I'll never find someone quite like you again
I'll never find someone quite like you again

I, I looked into your eyes and saw 
A world that does not exist
I looked into your eyes
And saw a world I wish I was in

I'll never find someone quite as touched as you
I'll never love someone quite the way that I loved you",1998
Burning Our Bed,Alice Cooper,https://www.azlyrics.com/lyrics/alicecooper/burningourbed.html,"[Alice Cooper/Al Pitrelli/Bob Pfeifer/Steve West]

Baby, don't you shed a tear for me
I wouldn't want to waste your time
You talked a lot of trash and ya lied to me
But babe, you never even tried

Oh, oh, oh
You can hold my heart for ransom
But you'll never own my soul

[CHORUS]
Baby, I might lose my mind
Maybe I might lose my head
But one thing I'll never do
Is swallow my pride crawlin' back to you
Baby, I'm burning our bed

There used to be a time when you were everything
My flame thru the night
You got me hot
Then you blew me out
Like this match I'm about to light

Oh, oh, oh
You can tear my heart to pieces
Left me standing in the cold

Baby, I might lose my mind
Maybe I might lose my head
One thing I gotta do
Is torch those sheets and pillows too
Baby, I'm burning out bed

Well, I used to think your were so fine
How could I be so blind

Oh, oh, oh
I'm freem
But I'm alone

[CHORUS]

Sometimes a man can bleed
Baby, I'm burning our bed

[CHORUS]",1991
Gloomy Sunday,Sarah McLachlan,https://www.azlyrics.com/lyrics/sarahmclachlan/gloomysunday.html,"Sunday is Gloomy,
My hours are slumberless,
Dearest, the shadows I live with are numberless
Little white flowers will never awaken you

Not where the black coach of sorrow has taken you
Angels have no thought of ever returning you
Would they be angry if I thought of joining you
Gloomy Sunday

Sunday is gloomy
with shadows I spend it all
My heart and I have decided to end it all
Soon there'll be flowers and prayers that are sad,
I know, let them not weep,
Let them know that I'm glad to go

Death is no dream,
For in death I'm caressing you
With the last breath of my soul I'll be blessing you
Gloomy Sunday

Dreaming
I was only dreaming
I wake and I find you
Asleep in the deep of
My heart
Dear

Darling I hope that my dream never haunted you
My heart is telling you how much I wanted you
Gloomy Sunday",
A Hard Rain's a-Gonna Fall,Bob Dylan,https://www.azlyrics.com/lyrics/bobdylan/ahardrainsagonnafall.html,"Oh, where have you been, my blue-eyed son?
And where have you been, my darling young one?
I've stumbled on the side of twelve misty mountains
I've walked and I've crawled on six crooked highways
I've stepped in the middle of seven sad forests
I've been out in front of a dozen dead oceans
I've been ten thousand miles in the mouth of a graveyard
And it's a hard, it's a hard, it's a hard, and it's a hard
It's a hard rain's a-gonna fall

Oh, what did you see, my blue-eyed son?
And what did you see, my darling young one?
I saw a newborn baby with wild wolves all around it
I saw a highway of diamonds with nobody on it
I saw a black branch with blood that kept drippin'
I saw a room full of men with their hammers a-bleedin'
I saw a white ladder all covered with water
I saw ten thousand talkers whose tongues were all broken
I saw guns and sharp swords in the hands of young children
And it's a hard, it's a hard, it's a hard, and it's a hard
It's a hard rain's a-gonna fall

And what did you hear, my blue-eyed son?
And what did you hear, my darling young one?
I heard the sound of a thunder, that roared out a warnin'
I heard the roar of a wave that could drown the whole world
I heard one hundred drummers whose hands were a-blazin'
I heard ten thousand whisperin' and nobody listenin'
I heard one person starve, I heard many people laughin'
Heard the song of a poet who died in the gutter
Heard the sound of a clown who cried in the alley
And it's a hard, it's a hard, it's a hard, it's a hard
It's a hard rain's a-gonna fall

Oh, what did you meet, my blue-eyed son?
Who did you meet, my darling young one?
I met a young child beside a dead pony
I met a white man who walked a black dog
I met a young woman whose body was burning
I met a young girl, she gave me a rainbow
I met one man who was wounded in love
I met another man who was wounded in hatred
And it's a hard, it's a hard, it's a hard, it's a hard
It's a hard rain's a-gonna fall

And what'll you do now, my blue-eyed son?
And what'll you do now, my darling young one?
I'm a-goin' back out 'fore the rain starts a-fallin'
I'll walk to the depths of the deepest dark forest
Where the people are many and their hands are all empty
Where the pellets of poison are flooding their waters
Where the home in the valley meets the damp dirty prison
And the executioner's face is always well hidden
Where hunger is ugly, where souls are forgotten
Where black is the color, where none is the number
And I'll tell and speak it and think it and breathe it
And reflect from the mountain so all souls can see it
And I'll stand on the ocean until I start sinkin'
But I'll know my song well before I start singin'
And it's a hard, it's a hard, it's a hard, and it's a hard
It's a hard rain's a-gonna fall",1963
Way to Blue,Nick Drake,https://www.azlyrics.com/lyrics/nickdrake/waytoblue.html,"Don't you have a word to show what may be done
Have you never heard a way to find the sun
Tell me all that you may know
Show me what you have to show
Won't you come and say
If you know the way to blue?

Have you seen the land living by the breeze
Can you understand a light among the trees
Tell me all that you may know
Show me what you have to show
Tell us all today
If you know the way to blue?

Look through time and find your rhyme
Tell us what you find
We will wait at your gate
Hoping like the blind.

Can you now recall all that you have known?
Will you never fall
When the light has flown?
Tell me all that you may know
Show me what you have to show
Won't you come and say
If you know the way to blue?",1969
'Cello Song,Nick Drake,https://www.azlyrics.com/lyrics/nickdrake/cellosong.html,"Strange face, with your eyes
So pale and sincere.
Underneath you know well
You have nothing to fear.
For the dreams that came to you when so young
Told of a life
Where spring is sprung.

You would seem so frail
In the cold of the night
When the armies of emotion
Go out to fight.
But while the earth sinks to its grave
You sail to the sky
On the crest of a wave.

So forget this cruel world
Where I belong
I'll just sit and wait
And sing my song.
And if one day you should see me in the crowd
Lend a hand and lift me
To your place in the cloud.",1969
Man in a Shed,Nick Drake,https://www.azlyrics.com/lyrics/nickdrake/maninashed.html,"Well there was a man who lived in a shed
Spent most of his days out of his head
For his shed was rotten let in the rain
Said it was enough to drive any man insane
When it rained
He felt so bad
When it snowed he felt just simply sad.

Well there was a girl who lived nearby
Whenever he saw her he could only simply sigh
But she lived in a house so very big and grand
For him it seemed like some very distant land
So when he called her
His shed to mend,
She said I'm sorry you'll just have to find a friend.

Well this story is not so very new
But the man is me, yes and the girl is you
So leave your house come into my shed
Please stop my world from raining through my head
Please don't think 
I'm not your sort
You'll find that sheds are nicer than you thought.",1969
After All,David Bowie,https://www.azlyrics.com/lyrics/davidbowie/afterall.html,"Please trip them gently, they don't like to fall, Oh by jingo

There's no room for anger, we're all very small, Oh by jingo

We're painting our faces and dressing in thoughts from the skies, 
From paradise 
But they think that we're holding a secretive ball. 
Won't someone invite them 
They're just taller children, that's all, after all 

Man is an obstacle, sad as the clown, Oh by jingo 
So hold on to nothing, and he won't let you down, Oh by jingo 
Some people are marching together and some on their own
Quite alone 
Others are running, the smaller ones crawl
But some sit in silence, they're just older children 
That's all, after all 

I sing with impertinence, shading impermanent chords, with my words 
I've borrowed your time and I'm sorry I called 
But the thought just occurred that we're nobody's children At all, after all 
Live till your rebirth and do what you will, Oh by jingo 
Forget all I've said, please bear me no ill, Oh by jingo 

After all, after all",1970
Freelove,Depeche Mode,https://www.azlyrics.com/lyrics/depechemode/freelove.html,"If you've been hiding from love
If you've been hiding from love
I can understand where you're coming from
I can understand where you're coming from

If you've suffered enough
If you've suffered enough
I can understand what you're thinking of
I can see the pain that you're frightened of

And I'm only here
To bring you free love
Let's make it clear
That this is free love
No hidden catch
No strings attached
Just free love
No hidden catch
No strings attached
Just free love

I've been running like you
I've been running like you
Now you understand why I'm running scared
Now you understand why I'm running scared

I've been searching for truth
I've been searching for truth
And I haven't been getting anywhere
No I haven't been getting anywhere

And I'm only here
To bring you free love
Let's make it clear
That this is free love
No hidden catch
No strings attached
Just free love
No hidden catch
No strings attached
Just free love

Hey girl
You've got to take this moment
Then let it slip away
Let go of complicated feelings
Then there's no price to pay

We've been running from love
We've been running from love
And we don't know what we're doing here
No we don't know what we're doing here

We're only here
Sharing our free love
Let's make it clear
That this is free love
No hidden catch
No strings attached
Just free love
No hidden catch
No strings attached
Just free love",2001
Look After Me,Hot Chip,https://www.azlyrics.com/lyrics/hotchip/lookafterme.html,"Look after me and I will look after you
Thats something we both forgot to do
[X2]

I find it hard to see your face, du du de de hay
Cannot remember it well enough, only the details such, then I see it in my head,
When I am with you its familiar and beautiful, and ?

As night comes in I know it better, seeing it clear again

Look after me and I will look after you
Thats something we both forgot to do
[X2]

Cus if I squint then I see your so, far from me, far from me
As if my miralce I see the room I see ?

The words and images they come back to me, back to me
Crystal clear in my head, but its behind the screen

Look after me and I will look after you
Thats something we both forgot to do
[X3]

Everytime I see your face I break down and cry, 
I see it in your family as they walk on by

Come back to me and ill come back to you,
Thats something we dont always do
[X2]",2006
Atrocity Exhibition,Joy Division,https://www.azlyrics.com/lyrics/joydivision/atrocityexhibition.html,"Asylums with doors open wide,
Where people had paid to see inside,
For entertainment they watch his body twist,
Behind his eyes he says, 'I still exist.'

This is the way, step inside.
This is the way, step inside...

In arenas he kills for a prize,
Wins a minute to add to his life.
But the sickness is drowned by cries for more,
Pray to God, make it quick, watch him fall.

This is the way, step inside.
This is the way, step inside...

This is the way, step inside.
This is the way, step inside...

You'll see the horrors of a faraway place,
Meet the architects of law face to face.
See mass murder on a scale you've never seen,
And all the ones who try hard to succeed.

This is the way, step inside.
This is the way, step inside...

And I picked on the whims of a thousand or more,
Still pursuing the path that's been buried for years,
All the dead wood from jungles and cities on fire,
Can't replace or relate, can't release or repair,
Take my hand and I'll show you what was and will be.",1980
Summer '68,Pink Floyd,https://www.azlyrics.com/lyrics/pinkfloyd/summer68.html,"Would you like to say something before you leave?
Perhaps you'd care to state exactly how you feel
We say goodbye before we've said hello
I hardly even like you
I shouldn't care at all
We met just six hours ago
The music was too loud
From your bed I gained a day and lost a bloody year

And I would like to know, how do you feel?
How do you feel?
How do you feel, how do you feel?

Not a single word was said
The night still hid our fears
Occasionally you showed a smile, but what was the need?
I felt the cold far too soon - in a room of ninety five
My friends are lying in the sun, I wish that I was there
Tomorrow brings another town, another girl like you
Have you time before you leave to greet another man

Just to let me know, how do you feel?
How do you feel?
How do you feel, how do you feel?

Goodbye to you
Charlotte Pringle's due
I've had enough for one day",1970
Small Blue Thing,Suzanne Vega,https://www.azlyrics.com/lyrics/suzannevega/smallbluething.html,"Today I am
A small blue thing
Like a marble
Or an eye

With my knees against my mouth
I am perfectly round
I am watching you

I am cold against your skin
You are perfectly reflected
I am lost inside your pocket
I am lost against
Your fingers

I am falling down the stairs
I am skipping on the sidewalk
I am thrown against the sky

I am raining down in pieces
I am scattering like light
Scattering like light
Scattering like light

Today I am
A small blue thing
Made of china
Made of glass

I am cool and smooth and curious
I never blink
I am turning in your hand
Turning in your hand
Small blue thing",1985
Infinita tristeza,Manu Chao,https://www.azlyrics.com/lyrics/manuchao/infinitatristeza.html,"Ljudi vseh stran i kantinentov!
Tsherez neskal'ko minut magutshi
Kasmitsheski karavi' unecÃ«t menja
V dalÃ«kie prastor'i vselennoi

Ja isl'ital Val'shae stshast'e
V'it' pere'im v kasmose, vstupit'
Adin na adin
V nev'ival'i paedinak s priradoi

Chers amis lointains ou tres proches
Habitants de touts les pays et de tous les continents
Dans quelques minutes un puissant vaisseau
cosmique m'emportera loin dans l'espace.

Infinita tristeza... infinita tristeza...
Infinita tristeza... infinita tristeza...
Infinita tristeza...

Permanece a la escucha

Gavorit Maskva...

J'ai peine a dÃ©crire ce que jâÃ©prouve.
Mais il me semble que j'ai
vÃ©cu toute ma vie dans
l'attente de ce moment la.
J'ai vraiment le sentiment
d'engager un combat sans
prÃ©cÃ©dent avec la nature.
Le moral est bon. je poursuis le vol.
Tout va bien. L'engin fonctionne normalement.

Infinita tristeza... infinita tristeza...
Infinita tristeza... infinita tristeza...
Infinita tristeza...

[Boy:] MamÃ¡...?
[Mum:] QuÃ©?
(SeÃ±or presidente)
[Boy:] Puedo tener Hijos?
[Mum:] Ahora no porque tienes siete aÃ±os
(SeÃ±or presidente)
[Mum:] Pero los tendrÃ¡ cuando seas mayor y te cases
[Boy 2:] QuiÃ©n tiene antes el niÃ±o, la madre o el padre
[Mum:] El padre pone la semilla como te he dicho,
Y la madre pone la tierra
En que esa semilla harÃ¡ la flor.
[Boy:] Y quiÃ©n es la flor?
[Mum:] TÃº
[Boy:] Por quÃ© no crecen los niÃ±os dentro de los papÃ¡s?
Yo ya estoy deseando tener niÃ±os, y tÃº Quique?
[Quique:] Oh Yo no...
[Boy:] Y tÃº Quique... y tÃº Quique
(El mÃ©dico del pueblo)
[Boy:] Y tÃº Quique?
[Mum:] Yo siempre estarÃ© a tu lado
Yo siempre estarÃ© a tu lado
(El mÃ©dico del pueblo)
[Boy:] Y tÃº Quique?
[Mum:] Solo quererse mucho
[Boy:] Y tÃº Quique...? Y tÃº Quique...?
[Mum:] Solo quererse mucho
[Boy:] Yo siempre estarÃ© a tu lado
[Boy:] Oye MamÃ¡! Puedo tener niÃ±os ya?

(Siete cincuenta y siete
El mÃ©dico del pueblo. Siete cincuenta y siete
El mÃ©dico del pueblo.
Artritis, asma, diabetes, impotencias)

(Hoy tenemos la oportunidad
De dirigirnos a todos los niÃ±os
Es un momento muy importante, definitivo
Revelaros el secreto mÃ¡s grande de la humanidad
La verdad sobre el nacimiento de los niÃ±os)

(Mitad y mitad es suficiente)

(Radio mano papachango)

(Nos hemos decidido a revelaros este misterios
Porque no consideramos justo el que vosotros
Grandes y verdaderos amigos de lo autentico
Os sintais engaÃ±ados
No ya por vuestros padres, naturalmente
Sino por otras opiniones ignorantes
( ignorantes ignorantes ignorantes...)
[Boy:] Y quÃ© tienen que hacer el padre y la
Madre para tener niÃ±os
[Mum:] Solo quererse mucho.
Yo siempre estarÃ© a tu lado.
Solo quererse mucho. Yo siempre estarÃ© a tu lado.
[Boy:] Y tÃº Quique?
[Mum:] Yo siempre estarÃ© a tu lado
[Quique:] Como vivimos dentro de ti?
[Mum:] Pues como la luz vive en su lampara
[Boy:] Y tÃº Quique?
[Mum:] O el agua dentro del vaso es como si
Quisiera ver el interior de un corazÃ³n
(Radio mano papachango)
[Boy:] Y tÃº Quique?
[Mum:] Yo siempre estarÃ© a tu lado
[Chorus:] Que hora son mi corazÃ³n?
[Mum:] Yo siempre estarÃ© a tu lado
[Chorus:] Que hora son mi corazÃ³n
[Mum:] Yo siempre siempre estarÃ© a tu lado
[Boy:] Y tu Quique?
[Mum:] Yo siempre estarÃ© a tu lado
[Chorus:] Que hora son mi corazÃ³n?
[Mum:] Yo siempre estarÃ© a tu lado...
Yo siempre estare a tu lado
[Boy:] Y tÃº Quique?
[Mum:] Yo siempre estarÃ© a tu lado
[Man:] Debemos mantenernos ... al aire?
(Radio M)
[Man:] es la seÃ±al, los tiranos vienen hacia acÃ¡
No estamos listos para ello
Tendremos que hacer algo
[Pregonero:] PrÃ³xima estaciÃ³n
[Woman:] Esperanza: avenida de la paz",2001
Lovestain,José González,https://www.azlyrics.com/lyrics/josgonzlez/lovestain.html,"You left a lovestain on my heart 
And you left a bloodstain on the ground 
But blood comes off easily 

But blood comes off easily 

You left a lovestain on my heart 
And you left a bloodstain on the ground 
But blood comes off easily 

But blood comes off easily",2003
That I Would Be Good,Alanis Morissette,https://www.azlyrics.com/lyrics/alanismorissette/thatiwouldbegood.html,"that I would be good even if I did nothing
that I would be good even if I got the thumbs down
that I would be good if I got and stayed sick
that I would be good even if I gained ten pounds

that I would be fine even if I went bankrupt
that I would be good if I lost my hair and my youth
that I would be great if I was no longer queen
that I would be grand if I was not all knowing

that I would be loved even when I numb myself
that I would be good even when I am overwhelmed
that I would be loved even when I was fuming
that I would be good even if I was clingy

that I would be good even if I lost sanity
that I would be good
whether with or without you",1998
Independence Day,Bruce Springsteen,https://www.azlyrics.com/lyrics/brucespringsteen/independenceday.html,"Well Papa go to bed now it's getting late 
Nothing we can say is gonna change anything now 
I'll be leaving in the morning from St. Mary's Gate 
We wouldn't change this thing even if we could somehow 
Cause the darkness of this house has got the best of us 
There's a darkness in this town that's got us too 
But they can't touch me now 
And you can't touch me now 
They ain't gonna do to me 
What I watched them do to you 

So say goodbye it's Independence Day 
It's Independence Day 
All down the line 
Just say goodbye it's Independence Day 
It's Independence Day this time 

Now I don't know what it always was with us 
We chose the words, and yeah, we drew the lines 
There was just no way this house could hold the two of us 
I guess that we were just too much of the same kind 

Well say goodbye it's Independence Day 
It's Independence Day all boys must run away 
So say goodbye it's Independence Day 
All men must make their way come Independence Day 

Now the rooms are all empty down at Frankie's joint 
And the highway she's deserted clear down to Breaker's Point 
There's a lot of people leaving town now 
leaving their friends, their homes 
At night they walk that dark and dusty highway all alone 

Well Papa go to bed now, it's getting late 
Nothing we can say can change anything now 
Because there's just different people coming down here now and they see things in different ways 
And soon everything we've known will just be swept away 

So say goodbye it's Independence Day 
Papa now I know the things you wanted that you could not say 
But won't you just say goodbye it's Independence Day 
I swear I never meant to take those things away",1980
Shut Out the Light,Bruce Springsteen,https://www.azlyrics.com/lyrics/brucespringsteen/shutoutthelight.html,"The runway rushed up at him as he felt the wheels touch down
He stood out on the blacktop and took a taxi into town
He got out down on Main Street and went into a local bar
He bought a drink and found a seat in a corner off the dark
Well she called up her mama to make sure the kids were out of the house
She checked herself out in the dining room mirror
And undid an extra button on her blouse
He felt her lying next to him, the clock said 4:00 am
He was staring at the ceiling
He couldn't move his hands

Oh mama mama mama come quick
I've got the shakes and I'm gonna be sick
Throw your arms around me in the cold dark night
Hey now mama don't shut out the light
Don't you shut out the light
Don't you shut out the light
Don't you shut out the light
Don't you shut out the light

Well on his porch they stretched a banner that said ""Johnny Welcome Home""
Bobby pulled his Ford out of the garage and they polished up the chrome
His mama said ""Johnny oh Johnny, I'm so glad to have you back with me""
His pa said he was sure they'd give him his job back down at the factory

Oh mama mama mama come quick
I've got the shakes and I'm gonna be sick
Throw your arms around me in the cold dark night
Hey now mama don't shut out the light
Don't you shut out the light
Don't you shut out the light
Don't you shut out the light
Don't you shut out the light

Well deep in a dark forest, a forest filled with rain
Beyond a stretch of Maryland pines there's a river without a name
In the cold black water Johnson Leneir stands
He stares across the lights of the city and dreams of where he's been

Oh mama mama mama come quick
I've got the shakes and I'm gonna be sick
Throw your arms around me in the cold dark night
Hey now mama don't shut out the light
Don't you shut out the light
Don't you shut out the light
Don't you shut out the light
Don't you shut out the light",
You,Candlebox,https://www.azlyrics.com/lyrics/candlebox/you.html,"You
It's for you
Only you
It's for you

I'll never know
I'll never care
I'll never believe my people
I'll tell you what I say
I'll never lie
I'll never try
I'll never cry for you people
I'll push you
Push away
As you lonely people
Keep on running 'round my door
Yes, you lonely people
Keep on begging
Beg for more
And I'll cry for you
Yes I'll die for you
Pain in my heart it is real
And I'll tell you now how I feel inside
Feel in my heart it's for you

It's for you
Only you
It's for you

I'll never try
I'll never die
I'll never push for you people
I'll tell you how I feel
I'll never lie
I'll never cry
I'll never try for you people
I'll tell you, yes it's real
As you lonely people
Keep on passing time away
Yes you lonely people keep on passing,
Pass away

And I'll cry for you
Yes, I'll die for you
Pain in my heart it is real
And I'll tell you now how I feel inside
Feel in my heart it's for you
And I'll take everything
As it comes my way
Pushin' your pain 'round my door
And I'll I cry for you as I die for you
Is this blood on my hands all for you?

You shiver
And shudder
Recovers your mother
You feel it take control
All alone
Feel alive
In your soul

Come around town
Steal another dime
Take another line
Won't you feel it
Blanket your soul
Out of mind

Come around town
Steal another dime
Do another crime
Won't you get it higher and higher
All through time

Come around town
Steal another dime
Don't you push your drugs in my face
Yes, I feel it
Feeling fine
Don't you push your drugs in my face
Or I'm gonna put you in your place
Fuck you
I don't want it no more
And it's mine
Said this pain in my heart is all mine
Yes, it's mine all alone

I don't want it no more
I don't want it no more
I don't want it no more
I don't want it no more

And it's mine on my own
Yes, it's mine all alone
As I cry for you
Yes, I'll die for you
Pain in my heart, it is real
And I'll take
Everything as it comes my way
Feel in my heart it's for you
And I'll lie for you as I die for you
Pain in my heart it is real
And I'll tell you now
How I feel inside
Fuck you
It's for you",1993
