song,artist,url,lyrics,year
Late Goodbye,Poets of the Fall,https://www.azlyrics.com/lyrics/poetsofthefall/lategoodbye.html,"In our headlights, staring, bleak, beer cans, deer's eyes
On the asphalt underneath, our crushed plans and my lies
Lonely street signs, powerlines, they keep on flashing, flashing by

And we keep driving into the night
It's a late goodbye, such a late goodbye
And we keep driving into the night
It's a late goodbye

Your breath hot upon my cheek, and we crossed, that line
You made me strong when I was feeling weak, and we crossed, that one time
Screaming stop signs, staring wild eyes, keep on flashing, flashing by

And we keep driving into the night
It's a late goodbye, such a late goodbye
And we keep driving into the night
It's a late goodbye

The devil grins from ear to ear when he sees the hand he's dealt us
Points at your flaming hair, and then we're playing hide and seek
I can't breathe easy here, less our trail's gone cold behind us
Till' in the john mirror you stare at yourself grown old and weak

And we keep driving into the night
It's a late goodbye, such a late goodbye...",2005
What You're Made Of,Lucie Silvas,https://www.azlyrics.com/lyrics/luciesilvas/whatyouremadeof.html,"Just like I predicted, we're at the point of no return
We can go backwards, and no corners have been turned
I can't control it, if I sink or if I swim
'Cause I chose the waters that I'm in

And it makes no difference who is right or wrong
I deserve much more than this
'Cause there's only one thing I want

[Chorus]
If it's not what you're made of
You're not what I'm looking for
You were willing but unable to give me anymore
There's no way,
You're changing,
Cause some things will just never be mine,
You're not in love this time...but it's alright.

I hear you talking, but your words don't mean a thing
I doubt you ever put your heart into anything
It's not much to ask for, to get back what I put in
But I chose the waters that I'm in

And it makes no difference who is right or wrong
I deserve much more than this
'Cause there's only one thing I want

[Chorus]
If it's not what you're made of
You're not what I'm looking for
You were willing but unable to give me anymore
There's no way,
You're changing,
Cause some things will just never be mine
You're not in love this time...but it's alright.

What's your definition of the one?
What do you really want him to become?
No matter what I sacrifice it's still never enough.

Just like I predicted
I will sink before I swim
'Cause these are the waters that I'm in

[Chorus]
If it's not what you're made of
You're not what I'm looking for
You were willing, but unable to give me anymore
There's no way,
You're changing,
'Cause some things will just never be mine
You're not in love this time.
Oh, if it's not what you're made of
You're not what I'm looking for
You were willing, but unable to give me anymore
There's no way,
You're changing,
'Cause some things will just never be mine
You're not in love this time
You're not in love this time
You're not in love this time...",2005
Paper Aeroplane,KT Tunstall,https://www.azlyrics.com/lyrics/kttunstall/paperaeroplane.html,"Well this stone that I have swallowed
Isn't going down so well
And this road that I have followed
Is leading me to Hell

And you said it didn't matter
But I think you're a liar
Is this one of your talents
That stokes the very fire that burns you
Each time you try to live

And the earth will turn below you
The pressure is building
And something has to give
Oh something has to give

And when I build you a steeple
You say it's incomplete
'Cause you need the whole cathedral
To satisfy the need

And you're like a paper aeroplane
That never seems to land
Flying blind through anything
Straight into the hand that chokes you
Each time you try to live

And the earth will turn below you
The pressure is building
And something has to give
Oh something has to give

Well you're like a paper aeroplane
That never seems to land
Flying blind through anything
Straight into the hand

Well you're like a paper aeroplane
That never seems to land
Flying blind through anything
Straight into the hand that chokes you
Each time you try to live

And the earth will turn below you
The pressure is building
The pressure is building
The fire that burns you
Each time you try to live

And the earth will turn below you
The pressure is building
And something has to give
Something has to give
Something has to give
Something has to give
Something has to give
Give",2007
Anywhere I Lay My Head,Tom Waits,https://www.azlyrics.com/lyrics/tomwaits/anywhereilaymyhead.html,"My head is spinning round
My heart is in my shoes
I went and set the Thames on fire
Now I must come back down
She's laughing in her sleeve at me
I can feel it in my bones
But anywhere I'm gonna
Lay my head, boys
I'm will call my home

Well I see that
The world is upside down
My pockets were filled up with gold
Now the clouds have covered o'er
And the wind is blowing cold
I don't need anybody
Because I learned to be alone
And anywhere
I lay my head, boys
I will call my home",1985
Perfect,The Smashing Pumpkins,https://www.azlyrics.com/lyrics/smashingpumpkins/perfect.html,"I know we're just like old friends 
We just can't pretend 
That lovers make amends 
We are reasons so unreal 
We can't help but feel that something has been lost 

But please you know you're just like me 
Next time I promise we'll be 
Perfect 
Perfect 
Perfect strangers down the line 
Lovers out of time 
Memories unwind 

So far I still know who you are 
But now I wonder who I was... 

Angel, you know it's not the end 
We'll always be good friends 
The letters have been sent on 

So please, you always were so free 
You'll see, I promise we'll be 
Perfect 
Perfect strangers when we meet 
Strangers on the street 
Lovers while we sleep

Perfect 
You know this has to be 
We always we're so free 
We promised that we'd be 
Perfect",1998
Jacob's Dream,Alison Krauss,https://www.azlyrics.com/lyrics/alisonkrauss/jacobsdream.html,"In the spring of 1856 with the snow still on the ground
Two little boys were lost in the mountains above the town
The father went out hunting the boys had stayed behind
While mother tended to her chores they wandered from her side

The two had gone to follow him and lost their way instead
By dusk the boys had not been found and fear had turned to dread
200 men had gathered there to comb the mountain side
The fires were built on the highest peak in hopes they'd see the light

Oh mommy and daddy why can't you hear our cries
The day is almost over, soon it will be night
We're so cold and hungry and our feet are tired and sore
We promise not to stray again from our cabin door

Now Jacob Diverd woke one night from a strange and erie dream
He saw a path between two hills near a dark and swollen stream
He told his wife he saw the boys huddled close beside a log
For two more nights the dream returned this vision sent from God

Oh mommy and daddy why can't you hear our cries
The day is almost over, soon it will be night
We're so cold and hungry and our feet are tired and sore
We promise not to stray again from our cabin door

a thousand men had searched in vain the west side of pop's creek
But Jacob's wife knew of this place and said to travel east
With a guide to take him there, Jacob came upon the scene
And found the boys cold and still beneath the old birch tree

Oh mommy and daddy, look past the tears you cry
We're both up in Heaven now, God is by our side
As you lay us down to rest in the presence of the Lord
Know that we will meet you here at Heaven's door

Oh mommy and daddy, look past the tears you cry
We're both up in Heaven now, God is by our side
And as you lay us down to rest in the presence of the Lord
Know that we will meet you here at Heaven's door",ompi
Saint James Infirmary,Van Morrison,https://www.azlyrics.com/lyrics/vanmorrison/saintjamesinfirmary.html,"I went down to Saint James Infirmary
For to see, for to see my baby there
Man, she was laid out on a long white table
She was so cold, and so cool, and so fair

Let her go, let her go, God bless her
Wherever she might be
Lord, you can search this whole wide world over
But she ain't never going to find another lover man like me

When I die, I want you to dress me in straight lace shoes
I want a box back coat and a stetson hat
I want a 20 dollar gold piece on my watch chain
So everybody goin' to know that I died standing pat",2003
Nothing to Lose,Billy Talent,https://www.azlyrics.com/lyrics/billytalent/nothingtolose.html,"Need more friends with wings
All the angels I know
Put concrete in my veins
I'd always walk home alone
So I became lifeless
Just like my telephone

There's nothing to lose
When no one knows your name
There's nothing to gain
But the days don't seem to change

Never played truth or dare
I'd have to check my mirror
To see if I'm still here
My parents had no clue
That I ate all my lunches
Alone in the bathroom

There's nothing to lose
When no one knows your name
There's nothing to gain
But the days don't seem to change
There's nothing to lose
My notebook will explain
There's nothing to gain
And I can't fight the pain

Teachers said ""it's just a phase""
When I grow up my children
Will probably do the same
Kids just love to tease
Who'd know it put me underground at seventeen

There's nothing to lose
When no one knows your name
There's nothing to gain
But the days don't seem to change
There's nothing to lose
My notebook will explain
There's nothing to gain
And I can't fight the pain
There's nothing to lose
When no one knows your name
There's nothing to gain
My notebook will explain

There's nothing to lose
When no one knows your name
There's nothing to gain
And I just died today",2003
The Long Goodbye,Ronan Keating,https://www.azlyrics.com/lyrics/ronankeating/thelonggoodbye.html,"I know they say if you love somebody
You should set them free (so they say)
But it sure is hard to do
Yeah, it sure is hard to do
And I know they say if they don't come back again
Then it's meant to be (so they say)
But those words ain't pulling me through
Cos I'm still in love with you
I spend each day here waiting for a miracle
But it's just you and me going through the mill
(climbin' up a hill) 

This is the long goodbye
Somebody tell me why
Two lovers in love can't make it
Just what kind of love keeps breaking a heart?
No matter how hard I try
You're gonna make me cry
Come on, baby, it's over, let's face it
All that's happening here is a long goodbye

Sometimes I ask my heart did we really
Give our love a chance (just one more chance)
and I know without a doubt
We turned it inside out
And if we walked away
would make more sense (only self defense)
But it tears me up inside
Just to think we still could try
How long must we keep riding on a carousel
Going round and round and never getting anywhere?
(on a wing and prayer)

This is the long goodbye
Somebody tell me why
Two lovers in love can't make it
Just what kind of love keeps breaking a heart?
No matter how hard I try
You're gonna make me cry
Come on, baby, it's over, let's face it
All that's happening here is a long goodbye

How long must we keep riding on a carousel
Going round and round and never getting anywhere?
on a wing and prayer

This is the long goodbye
Somebody tell me why
Two lovers in love can't make it
Just what kind of love keeps breaking a heart?
No matter how hard I try
You're gonna make me cry
Come on, baby, it's over, let's face it
All that's happening here is a long goodbye 

The long goodbye
The long goodbye
This is the long goodbye

Someone please tell me why

Are you ever coming back again...",2002
Haunt You Every Day,Weezer,https://www.azlyrics.com/lyrics/weezer/hauntyoueveryday.html,"I don't feel the joy
I don't feel the pain
You were just a toy
I am just insane

Walking on my own
Leaving you behind
You were crying out
That you need to speak your mind

[Chorus:]
Ohhh
So alone in love
So alone in love
I'm gonna haunt you everyday
Haunt you everyday

I am gonna kill
When I need a thrill
Eating at the heart
until I've had my fill
When will stupid learn?
Fires gonna burn
Think of consequence
Then you move when it your turn

[Chorus:]
Ohhh
So alone in love
So alone in love
I'm gonna haunt you everyday
Haunt you everyday

[Guitar Solo]

Walking on my own
Leaving you behind
You were crying out
That you need to speak your mind

[Chorus:]
Ohhh
So alone in love
So alone in love
I'm gonna haunt you everyday
Haunt you everyday
haunt you everyday",2005
Don't Call Me Peanut,Bayside,https://www.azlyrics.com/lyrics/bayside/dontcallmepeanut.html,"Drink up beautiful.
I spiked your cup with angst and a heart attack, 
'cause I've got so much trapped 
It's all because of you. 
So I figured you might like some back.

And when I see her 
I'll tell her what's been on my mind 
all these sleepless nights. 
She'll recite her excuses 
Put my tail between these legs of mine 
like I do all the time.

I can't live my life 
knowing you'll be in his arms each time I blink my eyes. 
Know what goes on behind my back every night, 
afraid I'll never leave, 
afraid I'll never know what's good for me.

And when I see her 
I'll tell her what's been on my mind 
all these sleepless nights. 
She'll recite her excuses 
Put my tail between these legs of mine 
like I do all the time.

And now you say that, 
you say you love me. 
Well I may have your heart, 
he has your body. 
And now you swear that you're being honest, 
but you're not honest, 
and you never could be.

And when I see her 
I'll tell her what's been on my mind 
all these sleepless nights. 
She'll recite her excuses 
Put my tail between these legs of mine 
like I do all the time.",2005
Mad About You,Sting,https://www.azlyrics.com/lyrics/sting/madaboutyou.html,"A stone's throw from Jerusalem
I walked a lonely mile in the moonlight
And though a million stars were shining
My heart was lost on a distant planet
That whirls around the April moon
Whirling in an arc of sadness
I'm lost without you I'm lost without you
Though all my kingdoms turn to sand
And fall into the sea
I'm mad about you I'm mad about you

And from the dark secluded valleys
I heard the ancient sighs of sadness
But every step I thought of you
Every footstep only you
And every star a grain of sand
The leavings of a dried up ocean
Tell me, how much longer? How much longer?

They say a city in the desert lies
The vanity of an ancient king
But the city lies in broken pieces
Where the wind howls and the vultures sing
These are the works of man
This is the sum of our ambition
It would make a prison of my life
If you became another's wife
With every prison blown to dust
My enemies walk free
I'm mad about you I'm mad about you

And I have never in my life
Felt more alone than I do now
Although I claim dominions over all I see
It means nothing to me
There are no victories
In all our histories, without love

A stone's throw from Jerusalem
I walked a lonely mile in the moonlight
And though a million stars were shining
My heart was lost on a distant planet
That whirls around the April moon
Whirling in an arc of sadness
I'm lost without you I'm lost without you
And though you hold the keys to ruin
Of everything I see
With every prison blown to dust,
My enemies walk free
Though all my kingdoms turn to sand
And fall into the sea
I'm mad about you I'm mad about you",1991
Circle,Slipknot,https://www.azlyrics.com/lyrics/slipknot/circle.html,"Give me the dust of my father
Stand on the face of the ancients
Bare the secret flesh of time itself

Follow me (follow me)
I've come so far, I'm behind again
Follow me (follow me)
I wish so hard I'm there again
Follow me (follow me)
Follow me (follow me)

All that I wanted were things I had before
All that I needed I never needed more
All of my questions are answers to my sins
All of my endings are waiting to begin

I know the way but I falter
Can't be afraid of my patience
There's a sacred place Razel keeps safe

Follow me (follow me)
I've seen so much I'm blind again
Follow me (follow me)
I feel so bad I'm alive again
Follow me (follow me)

All that I wanted were things I had before
All that I needed I never needed more
All of my questions are answers to my sins
All of my endings are waiting to begin",2004
Do What I Gotta Do,Ralph Tresvant,https://www.azlyrics.com/lyrics/ralphtresvant/dowhatigottado.html,"(So, so hard, girl)
(I gotta)

I'm 'bout to do this
Oh, I guess it's one of those things
A man just has to do
But I promise
It'll work out for the better, baby
Trust me

(I gotta)

I've been feeling lately
Like being single or just alone
To get into myself

Love ain't easy
Making me crazy
Games that we play
Sometimes the rules have to change

I don't wanna treat her cruel
But I like honesty
So what am I gonna do?

I guess I'll do what I gotta do
And break her heart
I don't wanna see her cry
But it's hard to live a lie

So I gotta do what I gotta do
And break her heart
Though I love the girl
I know that
The best thing is for us to be apart

(Be apart, baby)
I gotta

Any good relationships starts
Inside of a happy man
I think she will understand

If I tell her straight up
Then she can only respect me
Even if we don't agree

I don't wanna treat her cruel
But I like honesty, baby
So what am I gonna do?

Oh, I've gotta do what I gotta do
And break her heart
I don't wanna see her cry
But it's hard to live a lie

So I gotta do what I gotta do
And break her heart
(Break her little heart)
Though I love the girl
I know that
The best thing is for us to be apart

Listen, baby

Oh, sugar, no
(Do what I gotta do)
I gotta do what I gotta do

Oh, baby
(What am I gonna do?)
Oh, let me break it to you gently
I don't want to
(Do what I gotta do)

All that I can do, do
(What am I gonna do?)

Do, do, do, do, do
(Do what I gotta do)
And I don't wanna see you cry, baby
But what am I gonna do?

Oh, I've gotta do what I gotta do
And break her heart
I don't wanna see her cry
But it's hard to live a lie

So I gotta do what I gotta do
And break her heart
(Break her little heart)
And though I love the girl
I know that
The best thing is for us to be apart

Do what I gotta do
And break her heart
(Her heart, girl)
I don't wanna see you cry, baby
But you know that it's driving me crazy

Do what I gotta do
And break her heart
And though I love the girl
I know that
The best thing is for us to be apart

(I know it's gonna work out for the better)
(And the best thing is for us to be apart)",1990
Penny to My Name,Eva Cassidy,https://www.azlyrics.com/lyrics/evacassidy/pennytomyname.html,"Bill and I got married following our first born 
Daddy left this gas & convenience store just before he died 
And I was only nineteen when I had my third baby 
And sometimes I think maybe I should've left here long ago 

Travellers are stopping by, check their oil and their p.s.i. 
Gas up and away to fly, moving down the line 
But this beat-up truck & worn out shoes always give me the blues 
Billy sucking down the booze nearly every night 

[Chorus]
I never seen the city lights 
How they must shine so bright 
Not like this country night 
The sky's black as coal 
And this gas-station mountain home 
Not a thing to call my own 
How I wish I was alone 
With a penny to my name 

Strangers say this mountain here is beautiful beyond compare 
But it's just a dumb old mountain; I see it every day 
If I could see sunset skies over fields of green or ocean-tides, 
City skyline in the night, I'll be dancing till the dawn 

[Chorus]

Bill and I got married following our first born 
Daddy left this gas & convenience store just before he died 
Maybe Bill & I someday will find a chance to get away 
Until then it's here I'll stay wishing on a star 

[Chorus]",2000
Heartless,Kris Allen,https://www.azlyrics.com/lyrics/krisallen/heartless.html,"In the night 
I hear 'em talk
Coldest story ever told
Somewhere far along this road
He lost his soul 
To a woman so heartless
How could you be so heartless
Oh
How could you be so heartless

How could you be so
Cold as the winter wind when it breeze yo
Just remember that you talkin' to me though
You know need to watch the way you talkin' to me you know
I mean after all the things that we've been through
I mean after all the things we got into
And yo I know of some things that you ain't told me
And yo I did some things but that's the old me
And now you wanna get me back and you gon' show me
So you walk around like you don't know me
You got a new friend
Well I got homies
But in the end it's still so lonely

In the night 
I hear 'em talk
The coldest story ever told
Somewhere far along this road 
He lost his soul 
To a woman so heartless
How could you be so heartless
Oh
How could you be so heartless

How could be so Dr. Evil
You're bringin' out a side of me that I dont know
I decided we weren't gon' speak so
Why we up 3 A.M. on the phone
Why does she be so mad at me fo'
Homie I dont know she's hot and cold
I won't stop I won't mess my groove up
'Cause I already know how this thing go
You run and tell your friends that you're leaving me
They say that they don't see what you see in me
You wait a couple months then you gon' see
You'll never find nobody better than 
Me

'Cause in the night 
I hear 'em talk
The coldest story ever told
Somewhere far along this road
He lost his soul 
To a woman so heartless
How could you be so heartless
Oh
How could you be so heartless

Talk and talk and talk and talk
Baby let's just knock it off
They don't know what we been through
They don't know 'bout me and you
So I got something new to see
And you just gon' keep hatin' me
And we just gon' be enemies
I know you can't believe
I could just leave it wrong
And you can't make it right
I'm gon' take off tonight
Into the night

In the night
I hear 'em talk
The coldest story ever told
Somewhere far far far he lost his soul 
To a woman so heartless
Oh
How could you be so heartless
Oh
How could you be so heartless
Oh

'Cause in the night
I hear 'em talk
The coldest story ever told
Somewhere far along this road
He lost his soul 
To a woman so heartless",2009
Too Late,M83,https://www.azlyrics.com/lyrics/m83/toolate.html,"I look into your eyes
Diving into the ocean
I look into your eyes
Falling

Like a wall of stars
We are ripe to fall

And if you are a ghost
I'll call your name again
And if you are a ghost
I'll call your name...

You, always.",2008
Power Trip Ballad,Maria Mena,https://www.azlyrics.com/lyrics/mariamena/powertripballad.html,"The way in which I fear is solely a reflection of you,
The devastating child of the power trip you forced me through.
But how could he leave you,
Could he fuck that whore he left you for?
Get revenge;

And by all means ask your nine year old daughter to choose between you,
Don't stay friends.
Now let her in on how he's the devil,
He's just been falsely portrayed.
But force her to go stay at his house once a week
'Cause you wanna get laid,
Ha-ha-ha-ha

Ask me why he scares me,
Do you wanna know why I'm angry?
Can't you tell I'm crying?
Mother, I don't feel good.

You will always be the bitter, saddest part of me.

Your girl's in the bathroom washing her hands again,
Why doesn't she eat?
Her father left us
What about me?
I can't rest,
I can't sleep.

Mommy loves you
I'm just tired of you and your brother's shit.
And you know I didn't mean to hit you,
But you were asking for it.
Ha-ha-ha-ha

Ask me why she scares me.
Do you wanna know why I'm angry?
Can't you tell I'm crying?
Mother, I don't feel good.

You will always be the bitter, saddest part of me.
You will always be the bitter, saddest part of me.

You will always be the bitter, saddest part of me.
You will always be the bitter, saddest part of me.
You will always be the bitter, saddest part of me.
You will always be the bitter, saddest part of me.",2008
Torch,Soft Cell,https://www.azlyrics.com/lyrics/softcell/torch.html,"I'm lost again and I'm on the run
Looking for love in a sad song
With your avenger eyes and your catlike ways I can hold you
You are a fool for me to be cruel
I'm leaning on this bar listening to you sing
And your sad song rings in my ears and I start to cry

He's searching
She's showing
See him held in a deep, deep spell
He knows she's glowing

I can find within my mind a way to go
I can look deep into your light and shout
Hold me
Hold me
Hold me
Hold me
Hold me

I hear the saxophone and it tears my soul
And we're feeling old, feeling so cold
She is the torch and she is the theme
She could be a dream but - oh boy - is she real
Try to avoid her eyes, to avoid her words
They will hit you with all that you feel

He's searching
She's showing
See him held in a deep, deep spell
He knows she's glowing

I can find within my mind a way to go
I can look deep into your light and shout
Hold me
Hold me
Hold me
Hold me
Hold me

See her eyes they are bright tonight.
See the stars coming out tonight.
See the moon looking down tonight
See how they light your way tonight. 

See my eyes they are bright tonight.
See my hands reaching out tonight.
Hear my words they are dynamite
See how they light your way tonight

See her eyes they are bright tonight
See her eyes they are bright tonight
See how they light your way tonight",1981
