song,artist,url,lyrics,year
Sing in Silence,Sonata Arctica,https://www.azlyrics.com/lyrics/sonataarctica/singinsilence.html,"You were daddy's girl nice and sweet
Never in trouble mommy's honey
Little child who just couldn't see
The pressure from her so called friends
Was simply too much

The monkey slowly climbed on her back
Offering an aid for her pain
Giving love and care
No-one cared, no-one cared...

Fragile like a rose on the snow
Eating all your strength and your money
Walking in the shade day and night
Never letting sunshine in your eyes like before

Cannot shake the monkey off your back
Did I see a spark on your eye
Was it just the last light of hope
That died, hope that died

""Forgive me, Father, my daily sin...""

How can I forgive you, never leave you
You know that if you live like, you will die like
Haven of Emotion, Mournful Ocean
Heiress of the Evening Sings in silence

""I need to have now, my daily sin...""

For all your life I prayed for time
To show you where the light lies
Now this is the end
One rose for the memory of the innosence...

""I know, my Father, I cannot win...""

Never will forgive you, never leave you
You know that if you live like, you will die like
How can I erase your pain and aid you
When Death wants to kiss you and you want kiss Him back...",2001
The Needle Has Landed,Neko Case,https://www.azlyrics.com/lyrics/nekocase/theneedlehaslanded.html,"Here I am in traffic's slow flow
Where the needle touched down
Carbon planes draw a cage round the air force base
Where the needle touched down
My foot on the brake it's ok to fly low
Over poor Spanaway

An eagle swooped down from a semi-trailer
Took the name of your town from a sharp-toothed freighter
The needle's the same that recorded and played
When you left me at the greyhound the year I moved away
And if I knew then what's so obvious now
You'd still be here baby
My baby, baby

So that's why I never come back here
That's why they spit out my name
Your ex's have clawed up the bible
Trying to keep me away
With the sledge of tectonic fever
The needle has landed again
Let it play

And the needle touched down
The needle is landing
And the needle touched down
The needle is landing

An eagle swooped down from a semi-trailer
Took the name of your town
From a sharp-toothed freighter
And if I knew then what's so obvious now
You'd still be here",2006
The Jeep Song,The Dresden Dolls,https://www.azlyrics.com/lyrics/dresdendolls/thejeepsong.html,"I've been driving around town 
With my head spinning around
Everywhere i look i see
Your '96 jeep cherokee

You're a bully and a clown
You made me cry and put me down
After all that ive been through
You'd think i'd hate the sight of you

But with every jeep i see
My broken heart still skips a beat
I guess its just my stupid luck
That all of boston drives that same black fucking truck

It could be him or am i tripping
And i'm crashing into everything
And thinking about skipping town a while
Until these cars go out of style...

I try to see it in reverse
It makes the situation hundreds of times worse
When i wonder if it makes you want to cry 
Every time you see a light blue volvo driving by

So dont tell me that you're off to see the world
I know you wont get very far
Dont call me if you get another girl baby
Just call me if you get another car

The number of them is insane
Every exit's an exboyfriend memory lane
Every major street's a minor heart attack
I see a red jeep and i want to paint it black

It could be him or am i tripping
And i'm crashing into everything
I can't wait til you trade that fucker in
By then they will have stuck me in the looney bin

It could be him my heart is pounding
Its just no use i'm surrounded
But someday i'll steal your car and switch the gears
And drive that cherokee straight off this trail of tears",2004
You Had Time,Ani DiFranco,https://www.azlyrics.com/lyrics/anidifranco/youhadtime.html,"how can I go home
with nothing to say
I know you're going to look at me that way
and say what did you do out there
and what did you decide
you said you needed time
and you had time

you are a china shop
and I am a bull
you are really good food
and I am full
I guess everything is timing
I guess everything's been said
so I am coming home with an empty head

you'll say did they love you or what
I'll say they love what I do
the only one who really loves me is you
and you'll say girl did you kick some butt
and I'll say I don't really remember
but my fingers are sore
and my voice is too

you'll say it's really good to see you
you'll say I missed you horribly
you'll say let me carry that
give that to me
and you will take the heavy stuff
and you will drive the car
and I'll look out the window making jokes
about the way things are

how can I go home
with nothing to say
I know you're going to look at me that way
and say what did you do out there
and what did you decide
you said you needed time
and you had time",1994
Joining You,Alanis Morissette,https://www.azlyrics.com/lyrics/alanismorissette/joiningyou.html,"dear dar(lin') your mom (my friend) left a message on my machine she was frantic
saying you were talking crazy that you wanted to do away with yourself
I guess she thought i'd be a perfect resort because we've had 
this inexplicable connection since our youth and yes they're in shock 
they are panicked you and your chronic them and their drama
you this embarrassment us in the middle of this delusion
if we were our bodies
if we were our futures
if we were our defenses i'd be joining you
if we were our culture
if we were our leaders
if we were our denials i'd be joining you
I remember vividly a day years ago we were camping you knew more than you thought you should know
you said ""I don't want ever to be brainwashed"" and you were mindboggling you were intense
you were uncomfortable in your own skin you were thirsty but mostly you were beautiful
if we were our nametags
if we were our rejections
if we were our outcomes i'd be joining you
if we were our indignities
if we were our successes
if we were our emotions i'd be joining you
you and I we're like 4 year olds we want to know why and how come about everything
we want to reveal ourselves at will and speak our minds and never talk small and be intuitive
and question mightily and find god my tortured beacon
we need to find like-minded companions
if we were their condemnations
if we were their projections
if we were our paranoias i'd be joining you
if we were our incomes
if we were our obsession
if we were our afflictions i'd be joining you
we need reflection we need a really good memory feel free to call me a little more often",1998
The World Is Black,Good Charlotte,https://www.azlyrics.com/lyrics/goodcharlotte/theworldisblack.html,"Turn on channel seven at a quarter to eight
You see the same damn thing it's just a different day and
No one really knows why this is happening
But it's happening
And everywhere you go it's just a different place
You get the same dark feeling
See the same sad faces
No one really cares that this is happening

We come into this world
And we all are the same
In that moment there's no one to blame

But the world is black
And hearts are cold
And there's no hope
That's what we're told
And we can't go back
It won't be the same
Forever changed
By the things we've seen, seen

Living in this place it's always been this way
There's no one doing nothing so there's nothing changed
And I can't live when this world just keeps dying
It's dying
People always tell me this is part of the plan
That God's got everybody in His hands
But I can only pray that God is listening
Is He listening?

We're living in this world
Growing colder everyday
Nothing can stay perfect now I see

But the world is black
And hearts are cold
And there's no hope
That's what we're told
And we can't go back
It won't be the same
Forever changed
By the things we've seen, seen, seen

We come into this world
And we all are the same
And in that moment there's no one to blame
But we're living in this world
Growing colder everyday
Nothing can stay perfect now I see

The world is black
And hearts are cold
There's no hope
That's what we're told
And we can't go back
(We can't go back)
It won't be the same
(It won't be the same)
Forever changed
(What will ever change)
By the things we've seen, seen, seen

Turn on channel seven at a quarter to eight
You see the same damn thing it's just a different day
And no one really knows why this is happening",2004
If You Tolerate This Your Children Will Be Next,Manic Street Preachers,https://www.azlyrics.com/lyrics/manicstreetpreachers/ifyoutoleratethisyourchildrenwillbenext.html,"The future teaches you to be alone
The present to be afraid and cold
So if I can shoot rabbits
Then I can shoot fascists

Bullets for your brain today
But we'll forget it all again
Monuments put from pen to paper
Turns me into a gutless wonder

And if you tolerate this
Then your children will be next
And if you tolerate this
Then your children will be next
Will be next
Will be next
Will be next

Gravity keeps my head down
Or is it maybe shame
At being so young and being so vain

Holes in your head today
But I'm a pacifist
I've walked La Ramblas
But not with real intent

And if you tolerate this
Then your children will be next
And if you tolerate this
Then your children will be next
Will be next
Will be next
Will be next
Will be next

And on the street tonight an old man plays
With newspaper cuttings of his glory days

And if you tolerate this
Then your children will be next
And if you tolerate this
Then your children will be next
Will be next
Will be next
Will be next",1998
A Design for Life,Manic Street Preachers,https://www.azlyrics.com/lyrics/manicstreetpreachers/adesignforlife.html,"Libraries gave us power
Then work came and made us free
What price now for a shallow piece of dignity

I wish I had a bottle
Right here in my dirty face to wear the scars 
To show from where I came

We don't talk about love we only want to get drunk
And we are not allowed to spend
As we are told that this is the end

A design for life
A design for life
A design for life
A design for life

I wish I had a bottle
Right here in my pretty face to wear the scars
To show from where I came

We don't talk about love we only want to get drunk
And we are not allowed to spend
As we are told that this is the end

A design for life
A design for life
A design for life
A design for life

We don't talk about love we only want to get drunk
And we are not allowed to spend
As we are told that this is the end

A design for life
A design for life
A design for life
A design for...",1996
Going To A Town,Rufus Wainwright,https://www.azlyrics.com/lyrics/rufuswainwright/goingtoatown.html,"I'm going to a town that has already been burnt down
I'm going to a place that has already been disgraced
I'm gonna see some folks who have already been let down
I'm so tired of America

I'm gonna make it up for all of The Sunday Times
I'm gonna make it up for all of the nursery rhymes
They never really seem to want to tell the truth
I'm so tired of you, America

Making my own way home, ain't gonna be alone
I've got a life to lead, America
I've got a life to lead

Tell me, do you really think you go to hell for having loved?
Tell me, enough of thinking everything that you've done is good
I really need to know, after soaking the body of Jesus Christ in blood
I'm so tired of America

I really need to know
I may just never see you again, or might as well
You took advantage of a world that loved you well
I'm going to a town that has already been burnt down
I'm so tired of you, America

Making my own way home, ain't gonna be alone
I've got a life to lead, America
I've got a life to lead
I got a soul to feed
I got a dream to heed
And that's all I need

Making my own way home, ain't gonna be alone
I'm going to a town
That has already been burnt down",2007
Have I Told You Lately,Van Morrison,https://www.azlyrics.com/lyrics/vanmorrison/haveitoldyoulately.html,"Have I told you lately that I love you
Have I told you there's no one above you
Fill my heart with gladness
Take away my sadness
Ease my troubles, that's what you do

Oh the morning sun in all its glory
Greets the day with hope and comfort too
And you fill my life with laughter
You can make it better
Ease my troubles that's what you do

There's a love that's divine
And it's yours and it's mine
Like the sun at the end of the day
We should give thanks and pray to the One

Have I told you lately that I love you
Have I told you there's no one above you
Fill my heart with gladness
Take away my sadness
Ease my troubles, that's what you do

There's a love that's divine
And it's yours and it's mine
And it shines like the sun
At the end of the day we will give thanks
And pray to the One

Have I told you lately that I love you
Have I told you there's no one above you
Fill my heart with gladness
Take away my sadness
Ease my troubles, that's what you do

Take away my sadness
Fill my life with gladness
Ease my troubles that's what you do
Fill my life with gladness
Take away my sadness
Ease my troubles that's what you do.",1989
New York Minute,Don Henley,https://www.azlyrics.com/lyrics/donhenley/newyorkminute.html,"Harry got up
Dressed all in black
Went down to the station
And he never came back
They found his clothing
Scattered somewhere down the track
And he won't be down on Wall Street
In the morning

He had a home
The love of a girl
But men get lost sometimes
As years unfurl
One day he crossed some line
And he was too much in this world
But I guess it doesn't matter anymore

In a New York minute
Everything can change
In a New York minute
Things can get pretty strange
In a New York minute
Everything can change
In a New York minute

Lying here in the darkness
I hear the sirens wail
Somebody going to emergency
Somebody's going to jail
If you find somebody to love in this world
You better hang on tooth and nail
The wolf is always at the door

In a New York minute
Everything can change
In a New York minute
Things can get a little strange
In a New York minute
Everything can change
In a New York minute

And in these days
When darkness falls early
And people rush home
To the ones they love
You better take a fool's advice
And take care of your own
One day they're here;
Next day they're gone

I pulled my coat around my shoulders
And took a walk down through the park
The leaves were falling around me
The groaning city in the gathering dark
On some solitary rock
A desperate lover left his mark,
""Baby, I've changed. Please come back.""

What the head makes cloudy
The heart makes very clear
The days were so much brighter
In the time when she was here
But I know there's somebody somewhere
Make these dark clouds disappear
Until that day, I have to believe
I believe, I believe

In a New York minute
Everything can change
In a New York minute
You can get out of the rain
In a New York minute
Everything can change
In a New York minute",1989
You Don't Know,Milow,https://www.azlyrics.com/lyrics/milow/youdontknow.html,"sometimes everything seems awkward and large
imagine a Wednesday evening in March
future and past at the same time
I make use of the night and start drinking a lot
although not ideal for now it's all that I've got
it's nice to know your name

You don't know you don't know
you don't know anything bout' me

an ocean a lake I need a place to drown
let's freeze the moment because we're going down
tomorrow you'll be gone, gone, gone
you're laughing too hard this all seems surreal
I feel peculiar now what do you feel
do you think there's a chance that we can fall

you don't know you don't know
you don't know anything about me
what do I know I know your name
you don't know you don't know
you don't know anything about me anymore

I gave up dreaming for a while
I gave up dreaming for a while

I've noticed these are mysterious days
I look at it like a jigsaw puzzle and gaze
with wide open mouth and burning eyes
if only I could start to care
my dreams and my Wednesdays ain't going nowhere
baby baby baby you don't know 

you don't know you don't know
you don't know anything about me
what do I know I know your name
you don't know you don't know
you don't know anything about me",2006
All Cried Out,Alison Moyet,https://www.azlyrics.com/lyrics/alisonmoyet/allcriedout.html,"(Around around around around around
Around around around around around
Around around around around around
Around around around around around)

You took your time to come back this time
The grass has grown under your feet
In your absence I changed my mind
And someone else is sitting in your seat

I know that I said there'd be no one else
I know that I said I'd be true
But baby, I've burned out cupid's arrow
And here's the short and the narrow
I've nothing left to offer you

I'm all cried out
You took a whole lot of loving
For a handful of nothing
(All cried out)
It's hard to give you something
When you're pushing and a-shoving me around

So don't look surprised
There was no disguise
You knew where I stood from the start
So stop
Look around you
You're right back where I found you
Take back your cold and empty heart

(All cried out)
I'm all cried out
You took a whole lot of loving
For a handful of nothing
(All cried out)
It's hard to give you something
When you're pushing and a-shoving
(All cried out)
I'm all cried out
You took a whole lot of loving
(All cried out)
I'm all cried out
It's hard to give you something
When you're pushing and a-shoving me around

(Around around around around around
Around around around around around)

(You go your way)
You go your way
(I'll go mine)
I'll go mine
(I won't stay around here)
I wont stay around here
Don't you waste my time
(Waste my time)

(All cried out)
You took a whole lot of loving
For a handful of nothing
(All cried out)
It's hard to give you something
When you're pushing and a-shoving
(All cried out)
I'm all cried out
You took a whole lot of loving
(All cried out)
I'm all cried out
It's hard to give you something
When you're pushing and a-shoving me around

(Around around around around around
Around around around around around
Around around around around around
Around around around around around)

You go your way
I'll go mine
I won't stay around here
Don't you waste my time

(All cried out
All cried out)
You took a whole lot of loving
For a handful of nothing
(All cried out
All cried out)
You took a whole lot of loving
(Around around around around around)
(All cried out)
You took a whole lot of loving
For a handful of nothing
(Around around around around around)
(All cried out)
It's hard to give you something
When you're pushing and a-shoving
(All cried out
All cried out)
You took a whole lot of loving
(All cried out).",
You Have Been Loved,George Michael,https://www.azlyrics.com/lyrics/georgemichael/youhavebeenloved.html,"She takes the back road and the lane
Past the school that has not changed
In all this time
She thinks of when the boy was young
All the battles she had won
Just to give him life

That man
She loved that man
For all his life
But now we meet to take him flowers
And only god knows why

For what's the use in pressing palms
When children fade in mother's arms
It's a cruel world
We've so much to lose
And what we have to learn, we rarely choose

So if it's god who took her son
He cannot be the one living in her mind

Take care my love, she said
Don't think that god is dead
Take care my love, she said

You have been loved

If i was weak, forgive me
But i was terrified
You brushed my eyes with angels wings, full of love
The kind that makes devils cry

So these days
My life has changed
And i'll be fine
But she just sits and counts the hours
Searching for her crime

So what's the use of pressing palms
If you won't keep such love from harm
It's a cruel world
You've so much to prove

And heaven help the ones who wait for you

Well i've no daughters, i've no sons
Guess i'm the only one
Living in my life

Take care my love, he said
Don't think that god is dead
Take care my love, he said

You have been loved",1996
Stop,Sam Brown,https://www.azlyrics.com/lyrics/sambrown/stop.html,"All that I have is all that you've given me
Did you ever worry that I'd come to depend on you
I gave you all the love I had in me
Now I find you've lied and I can't believe it's true

Wrapped in her arms I see you across the street
And I can't help but wonder if she knows what's going on
You talk of love but you don't know how it feels
When you realize that you're not the only one

Oh you'd better stop before you tear me all apart
You'd better stop before you go and break my heart
Ooh you'd better stop

Time after time I've tried to walk away
But it's not that easy when your soul is torn in two
So I just resign myself to it every day
Now all I can do is to leave it up to you

Oh you'd better stop before you tear me all apart
You'd better stop before you go and break my heart
Ooh you'd better stop

Stop if love me
(you will remember)
Now's the time to be sorry
(that day forever)
I won't believe that you'd walk out on me

Oh you'd better stop before you tear me all apart
You'd better stop before you go and break my heart
Ooh you'd better stop",1988
Song For Guy,Elton John,https://www.azlyrics.com/lyrics/eltonjohn/songforguy.html,"Life
Life isn't everything
Life isn't everything
Life isn't everything

Life
Life isn't everything
Life isn't everything
Life isn't everything

Life
Life isn't everything
Life isn't everything
Life isn't everything

Life...",1978
There Goes The Fear,Doves,https://www.azlyrics.com/lyrics/doves/theregoesthefear.html,"Out of here
We're out of here
Along with fear
There goes the fear again
There goes the fear

And cars speed fast
Out of here
And life goes past
Again so near
There goes the fear again
There goes the fear

Close your brown eyes
And lay down next to me
Close your eyes, lay down
'Cause there goes the fear
Let it go

You turn around and life's passed you by
You look to ones you love
to ask them why?
You look to those you love
to justify
You turned around and life's
passed you by
Passed you by, again

And late last night
Makes up her mind
Another fight
Left behind
There goes the fear again, let it go
There goes the fear

Close your brown eyes
And lay down next to me
Close your eyes, lay down
'Cause there goes the fear
Let it go

You turn around and life's
passed you by
You look to ones you love
to ask them why?
You look to those you love
to justify, why?
You turned around and life's
passed you by

Think of me when you're coming down
But don't look back when leaving town
Think of me when he's calling out
But don't look back when leaving town
Think of me when you close your eyes
But don't look back when you break all ties
Think of me when you're coming down
But don't look back when leaving town today

There goes the fear again, let it go
There goes the fear, let it go

Think of me when you close your eyes
But don't look back when you break all ties
Think of me when you're coming down
But don't look back when leaving town today",2002
Take It Easy (Love Nothing),Bright Eyes,https://www.azlyrics.com/lyrics/brighteyes/takeiteasylovenothing.html,"First with your hands and then with your mouth
A downpour of sweat, damp cotton clouds
I was a fool, you were my friend
We made it happen
You took off your clothes, left on the light
You stood there so brave
You used to be shy
Each feature improved, each movement refined and eyes like a showroom
Now they are spreading out the blankets on the beach
That weatherman is a liar
He said it would be raining but it's clear and blue as far as I can see

Left by the lamp, right next to the bed, 
On a cartoon cat pad she scratched with a pen,
""Everything is as it's always been. 
This never happened.
Don't take it too bad it is nothing you did.
It's just once something dies you can't make it live.
You're a beautiful boy.
You're a sweet little kid but I am a woman.""
So I laid back down and wrapped myself up in the sheet
And I must have looked like a ghost 'cause something frightened me
And since then I've been so good at vanishing

Now I do as I please and lie through my teeth
Someone might get hurt, but it won't be me
I should probably feel cheap but I just feel free...
And a little bit empty
No, it isn't so hard to get close to me
There will be no arguments
We will always agree
And I'll try and be kind when I ask you to leave
We'll both take it easy
But if you stay too long inside my memory,
I will trap you in a song tied to a melody
And I will keep you there so you can't bother me",2005
For Today I Am a Boy,Antony and the Johnsons,https://www.azlyrics.com/lyrics/antonyandthejohnsons/fortodayiamaboy.html,"One day I'll grow up, I'll be a beautiful woman
One day I'll grow up, I'll be a beautiful girl
One day I'll grow up, I'll be a beautiful woman
One day I'll grow up, I'll be a beautiful girl

But for today I am a child
For today I am a boy
For today I am a child
For today I am a boy

One day I'll grow up, I'll feel the power in me
One day I'll grow up, of this I'm sure
One day I'll grow up, I know a womb within me
One day I'll grow up, feel it full and pure

But for today I am a child
For today I am a boy
For today I am a child
For today I am a boy

For today I am a child
For today I am a boy
For today I am a child
For today I am a boy

(For today) For today I am a child
(For today) For today I am a boy
(For today) For today I am a child
(For today) For today I am a boy",2005
