song,artist,url,lyrics,year
Meet You There,Simple Plan,https://www.azlyrics.com/lyrics/simpleplan/meetyouthere.html,"Now you're gone,
I wonder why
You left me here,
I think about it on, and on, 
and on, and on, and on, again.
I know you're never coming back,
I hope that you can hear me,
I'm waiting to hear from you..

Until i do,
You're gone away,
I'm left alone,
A part of me is gone,
And I'm not moving on,
So wait for me,
I know the day will come..

I'll meet you there,
No matter where life takes me to,
I'll meet you there,
And even if I need you here,
I'll meet you there.

I wish I could have told you,
The things I kept inside,
But now I guess its just too late.
So many things remind me of you,
I hope that you can hear me,
I miss you,
This is goodbye,
One last time..

You're gone away,
I'm left alone,
A part of me is gone,
And I'm not moving on,
So wait for me,
I know the day will come..

I'll meet you there,
No matter where life takes me to,
I'll meet you there,
And even if I need you here,
I'll meet you there,
No matter where life takes me to,
I'll meet you there,
And even if I need you here,
I'll meet you there.

I'll meet you there....

And where I go you'll be there with me,
Forever you'll be right here with me..

I'll meet you there,
No matter where life takes me to,
I'll meet you there,
And even if I need you here,
I'll meet you there,
No matter where life takes me..
I'll meet you there,
And even if I need you..
I'll meet you there...

I'll meet you there...
I'll meet you there..",2002
Forever as One,Vengaboys,https://www.azlyrics.com/lyrics/vengaboys/foreverasone.html,"I wish I could turn back time 
I wish I'd never have to see that look in your eyes 
You really broke this heart of mine 
Now it's time to realise it's forever goodbye 

So here I am 
All alone 
Don't understand where did we go wrong 
I can't stop crying 
Can't take the pain 
Knowing you won't ever be back again 

And it cuts like a knife 
I'm going insane 
Wishing you would show me love 
Once again 
I'm losing my mind 
But I have to carry on 
We were meant to be together 
Forever as one 

So this is where the story ends 
Gonna take some to dry the tears in my eyes 
You told me we could still be friends 
Now I know your promises were nothing but lies 

So here 
I amAll alone 
Don't understand where did we go wrong 
I can't stop crying 
Can't take the pain 
Knowing you won't ever be back again 

And it cuts like a knife 
I'm going insane 
Wishing you would show me love 
Once again 
I'm losing my mind 
But I have to carry on 
We were ment to be together 
Forever as one",2000
The Saddest Song,The Ataris,https://www.azlyrics.com/lyrics/ataris/thesaddestsong.html,"Only two more days, until your birthday
Yesterday was mine
You'll be turning five
I know what it's like, growing up without your father in your life
So I pretend, I'm doing all I can
And I hope someday you'll find it in your heart

To understand
Why I'm not around
And forgive me for not being in your life

I remember waiting
For you to come
Remember waiting
For you to call
Remember waiting there to find nothing at all
I remember waiting
For you to come
Remember waiting
For you to call
Waiting there to find nothing at all

maybe someday
you really get to know me
not just the letters read to you
I pray I get the chance
To make it up to you
We got a lot of catching up to do

So I pretend, I'm doing all I can
And hope someday you'll find it in your heart

To understand
Why I'm not around
And forgive me for not being in your life

I remember waiting
For you to come
Remember waiting
For you to call
Remember waiting there to find nothing at all
I remember waiting
For you to come
Remember waiting
For you to call
Waiting there to find nothing at all

Forgive me!
I'm so sorry!
I will make it up to you....",2003
Redemption,Frank Turner,https://www.azlyrics.com/lyrics/frankturner/redemption.html,"I was walking home to my house through the snow from the station
When the Springsteen came clear in my headphones with a pertinent question
Oh is love really real and can any of us hope for redemption?
Or are we all merely biding our time down to lonely conclusions?
Darling let me take your hand as I talk you through this
How loneliness edged into deep seeded psychosis
Lying away in crowded hotel rooms focused on tape hiss
With my feelings laid clear on the ceiling
I don't think I can do this
I don't think I can do this

Well I tried so hard to not turn into my father
But if I only ever skip all his choices will I ever choose better?
Oh the sad truth is the grass it will always seem greener
So I left you alone in a restaurant in London in winter
You deserved better

Adam Trask is on my back and in my ears
And the sound comes clear and brings the awful truth
That I can't stand what I've done to you
And it's written clear in my diary
Today should have been our anniversary
And I'm far way and I'm far apart
And you're back home with a broken heart
And loves is real and I can't escape
I only ever have myself to blame

These failures shift and shake me in the night
Like a fever I can't break try as I might
Wake me darling I need you take me home
But I know in the end redemption is mine, and mine alone

So if each of us is made up of a tally of mistakes and successes
Then my hour in that restaurant makes my score less than impressive
But each can be redeemed with the courage with which he confesses
So darling I miss you, your music and your musk and your kisses
I don't think I can do this",2011
Shape of My Heart,Backstreet Boys,https://www.azlyrics.com/lyrics/backstreetboys/shapeofmyheart.html,"Baby, please try to forgive me
Stay here don't put out the glow

Hold me now, don't bother
If every minute it makes me weaker
You can save me from the man that I've become

Lookin' back on the things I've done
I was tryin' to be someone
I played my part,
Kept you in the dark
Now let me show you the shape of my heart

Sadness is beautiful, loneliness is tragical
So, help me, I can't win this war, oh no

Touch me now, don't bother
If every second it makes me weaker
You can save me from the man I've become

Lookin' back on the things I've done
I was tryin' to be someone
I played my part,
Kept you in the dark
Now let me show you the shape of my heart

I'm here with my confession
Got nothing to hide no more
I don't know where to start
But to show you the shape of my heart

I'm lookin' back on things I've done
I never wanna play the same old part
Or keep you in the dark
Now let me show you the shape of my heart

Lookin' back on the things I've done
I was tryin' to be someone
I played my part,
Kept you in the dark
Now let me show you the shape of my heart

Lookin' back on the things I've done
I was tryin' to be someone
I played my part,
Kept you in the dark
Now let me show you the shape of...
Show you the shape of my heart",2000
A Distance There Is,Theatre of Tragedy,https://www.azlyrics.com/lyrics/theatreoftragedy/adistancethereis.html,"Come in out of the rain thou sayest
But thou ne'er step'st aside
And I'm trapp'd, I'm trapp'd
A distance there is

None, save me and the bodkin
Pitter-patter on the roof
Behold! - 'tis not the rain
Thence me it has to be
I will not drink thy vintage wine, my dear
Thou hast heed'd that I am of innocence
Yet thou let'st thy lass into peril
Thou let'st me be parched

My heart is of frailty
My pale skin is hued damask

When thou thy tears hast hidden
""Come back!"", thou sayest
There I soon am to be
But how am I to run when my bones, my heart
Thou hast me bereaft
But run thou sayest
I run...

And there and then I behold that a time will come
When I again dead will be
Thou tell'st me to leave without delay
I leave...

Oh, I leave with my bodkin and my tears in my hands
Lo! - the shadows, the sky - descending
So by a dint of smite I gait ere I run and melt together with dusk

In my mind in which is this event
But it seems as if naught is to change anyway?

After all these years thou left'st me down in the emotional depths
The sombre soaked velvet-drape is hung upon me
Turning my feelings away from our so ignorant world
All the beautiful moments shared, deliberately push'd aside

After all these years thou left'st me down in the emotional depths
The sombre soaked velvet-drape is hung upon me
Turning my feelings away from our so ignorant world
All the beautiful moments shared, deliberately push'd aside

...A distance there is...",1995
Strange and Beautiful (I'll Put a Spell on You),Aqualung,https://www.azlyrics.com/lyrics/aqualung/strangeandbeautifulillputaspellonyou.html,"I've been watching your world from afar
I've been trying to be where you are
And I've been secretly falling apart
Unseen
To me, you're strange and you're beautiful
You'd be so perfect with me
But you just can't see
You turn every head but you don't see me

I'll put a spell on you
You'll fall asleep
When I put a spell on you
And when I wake you I'll be the first thing you see
And you'll realize that you love me

Yeah
Ye-ah

Sometimes the last thing you want comes in first
Sometimes the first thing you want never comes
But I know that waiting is all you can do
Sometimes

I'll put a spell on you
You'll fall asleep
When I put a spell on you
And when I wake you I'll be the first thing you see
And you'll realise that you love me

I'll put a spell on you
You'll fall asleep
Cause I put a spell on you 
And when I wake you I'll be the first thing you see
And you'll realize that you love me, yeah

Yeah
Ye-ah
Yeah
Ye-ah",2002
Forest of Love,Antony and the Johnsons,https://www.azlyrics.com/lyrics/antonyandthejohnsons/forestoflove.html,"I'm a girl, five years old 
God, don't take my boy
Give him back, my brother 
Murderer or beauty

Don't send him to the slaughter house 
Don't send him into watersnakes 
He needs from the forest
The forest of love

I will live, he can live 
Maybe we can be there
Forest is good, home inside 
Safest, warmest bed

Birds drinking from the stream
Hardened smell of grow
Trees all alive and will cry 
Washed by songs entirely

Don't send him to the ocean cold
Don't send him to the water afraid
He needs from the forest
The forest of love
The forest, the forest of love

I'm in the forest of love 
I'm in there, the forest of love
I'm in there, the forest of love
I'm in there, the forest of love

Ooh the here and now 
Ooh, my brother
Ooh, my brother
Ooh, my brother
Ooh, my brother, my brother

Don't send him to the ocean cold
Don't send him to the water afraid
He needs from the forest
The forest of love
The forest, the forest of love
The forest of love",P:  
Only Hope,Mandy Moore,https://www.azlyrics.com/lyrics/mandymoore/onlyhope.html,"[Written by Switchfoot]

There's a song that's inside of my soul
It's the one that I've tried to write over and over again
I'm awake in the infinite cold
But you sing to me over and over and over again

So I lay my head back down
And I lift my hands
And pray to be only yours
I pray to be only yours
I know now you're my only hope

Sing to me the song of the stars
Of your galaxy dancing
And laughing and laughing again
When it feels like my dreams are so far
Sing to me of the plans that you have for me over again

So I lay my head back down
And I lift my hands and pray
To be only yours
I pray to be only yours
I know now you're my only hope

I give you my destiny
I'm giving you all of me
I want your symphony
Singing in all that I am
At the top of my lungs I'm giving it back

So I lay my head back down
And I lift my hands and pray
To be only yours
I pray to be only yours
I pray to be only yours
I know now you're my only hope",
Into the Sun,Lifehouse,https://www.azlyrics.com/lyrics/lifehouse/intothesun.html,"It's been a while since you last saw me
One breaks down and the other ones fade
These eyes can see the days break
Too late for the other's mistakes

Sit down laugh thinking what have we done
Let me inside
Is it all over before it's begun
Please give me some time

Cause we are running into the sun
Getting close to something into the sun
You know that we're falling
We're falling back into the sun

I never meant to let you go
Why did I leave maybe we'll never know
But I'm a man now broken on the ground
I'm in need and I think that it shows

All this time we're going nowhere and we know it
I was so blind
All the lights are leading to where you're going
I'm not far behind

And now we're running into the sun
Getting close to something into the sun
You know that we're falling
We're falling back into the sun

Into the sun
Into the sun
Into the sun

You know that we're running into the sun
Getting close to something into the sun
You know that we're falling
We're falling back into the sun

Into the sun
Into the sun
Into the sun",2005
A Wolf at the Door.,Radiohead,https://www.azlyrics.com/lyrics/radiohead/awolfatthedoor.html,"Drag him out your window
Dragging out the dead
Singing I miss you
Snakes and ladders
Flip the lid
Out pops the cracker
Smacks you in the head
Knifes you in the neck
Kicks you in the teeth
Steel toe caps
Takes all your credit cards
Get up get the gunge

Get the eggs
Get the flan in the face
The flan in the face
The flan in the face
Dance you fucker dance you fucker
Don't you dare
Don't you dare
Don't you flan in the face

Take it where the love is given
Take it with a pinch of salt
Take it to the taxman

Let me back let me back
I promise to be good
Don't look in the mirror
At the face you don't recognize
Help me call the doctor
Put me inside
Put me inside
Put me inside
Put me inside
Put me inside

I keep the wolf from the door
He calls me up
Calls me on the phone
Tells me all the ways that he's gonna mess me up
Steal all my children
If I don't pay the ransom
And I'll never see them again
If I squeal to the cops

No no no no no no no

Walking like giant cranes ah
With my X-ray eyes I strip you naked
In a tight little world and why are you on the list?
Stepford wives who are we to complain?

Investments and dealers investments and dealers
Cold wives and mistresses
Cold wives and Sunday papers
City boys in first class
Don't know they're born little

Someone else is gonna come and clean it up
Born and raised for the job
Someone always does
I wish you'd get up get over get up get over
Turn your tape off

I keep the wolf from the door
He calls me up
Calls me on the phone
Tells me all the ways that he's gonna mess me up
Steal all my children
If I don't pay the ransom
And I'll never see them again
If I squeal to the cops

So I'm just gonna",2003
Hymn For The Missing,Red,https://www.azlyrics.com/lyrics/red/hymnforthemissing.html,"We tried to walk together
But the night was growing dark
Thought you were beside me
But I reached and you were gone
Sometimes I hear you calling
From some lost and distant shore
I hear you crying softly for the way it was before

Where are you now?
Are you lost?
Will I find you again?
Are you alone?
Are you afraid?
Are you searching for me?
Why did you go? I had to stay
Now I'm reaching for you
Will you wait? Will you wait?
Will I see you again?

You took it with you when you left
These scars are just a trace
Now it wanders lost and wounded
This heart that I misplaced

Where are you now?
Are you lost?
Will I find you again?
Are you alone?
Are you afraid?
Are you searching for me?
Why did you go? I had to stay
Now I'm reaching for you
Will you wait? Will you wait?
Will I see you again?",2011
Promise to Try,Madonna,https://www.azlyrics.com/lyrics/madonna/promisetotry.html,"Little girl don't you forget her face
Laughing away your tears
When she was the one who felt all the pain

Little girl never forget her eyes
Keep them alive inside
I promise to try -- it's not the same

Keep your head held high -- ride like the wind
Never look behind, life isn't fair
That's what you said, so I try not to care

Little girl don't run away so fast
I think you forgot to kiss -- kiss her goodbye

Will she see me cry when I stumble and fall
Does she hear my voice in the night when I call
Wipe away all your tears, it's gonna be all right

I fought to be so strong, I guess you knew
I was afraid you'd go away, too

Little girl you've got to forget the past
And learn to forgive me
I promise to try -- but it feels like a lie

Don't let memory play games with your mind
She's a faded smile frozen in time
I'm still hanging on -- but I'm doing it wrong
Can't kiss her goodbye -- but I promise to try",1989
I Will Love Again,Lara Fabian,https://www.azlyrics.com/lyrics/larafabian/iwillloveagain.html,"Did I ever tell you how you live in me
Every waking moment, even in my dreams
And if all this talk is crazy
And you don't know what I mean
Does it really matter
Just as long as I believe
[Chorus:]
I will love again
Though my heart is breaking, I will 
love again
Stronger than before
I will love again
Even if it takes a lifetime to get over you
Heaven only knows, I will love again
People never tell you
The way they truly feel
I would die for you gladly
If I knew it was for real
So if all this talk sounds crazy
And the words don't come out right
Does it really matter
If it gets me through this night
[Chorus]
If I'm true to myself, nobody else can take the place of you
But I've got to move on, tell me what else can I do
[Chorus]
I will love again
One day I know, I will love again
You can't stop me from loving again, breathing again
Feeling again
I know, one day, I'll love again",1999
Little Rock,Collin Raye,https://www.azlyrics.com/lyrics/collinraye/littlerock.html,"Well, I know I disappeared a time or two,
and along the way I lost me and you.
I needed a new town for my new start
selling VCR's in Arkansas at a Wal-Mart.

I haven't had a drink in nineteen days.
My eyes are clear and bright without that haze.
I like the preacher from the Church of Christ.
Sorry that I cried when I talked to you last night.

I think I'm on a roll here in Little Rock.
I'm solid as a stone, baby, wait and see.
I've got just one small problem here in Little Rock,
without you, baby I'm not me.

I don't know why I held it all inside,
you must've thought I never even tried.
You know your daddy told me when I left
that Jesus would forgive, but a daddy don't forget.

I think I'm on a roll here in Little Rock.
I'm solid as a stone, baby, wait and see.
I've got just one small problem here in Little Rock,
without you, baby I'm not me.

Lying here upon this motel bed,
my thoughts of you explode inside my head.
Like a castle built upon the sand,
I let love crumble in my hand.

I think I'm on a roll here in Little Rock.
I'm solid as a stone, baby, wait and see.
I've got just one small problem here in Little Rock,
without you, baby I'm not me.

Without you, baby I'm not me...

I think I'm on a roll here in Little Rock.",1994
I Love You,Dru Hill,https://www.azlyrics.com/lyrics/druhill/iloveyou.html,"[Nokio:]
The beauty's gone
My time wasn't enough (I'm spendin it all with you)
My heart wasn't enough (I'm givin' it to you)
My money wasn't enough (I'm givin' you all that)
My house wasn't enough (but you live in that)
And now you  wanna leave

[Verse One (Sisqo):]
Wish I never told you ""you should leave""
Wish me and you never had my seed
No I better stop it that's a lie
Cuz girl you were the apple of my eye
Took a little time for me to see
That girl I need you right here next to me
I could let you walk away
But I'm not goin out that way, no

[Hook (Sisqo):]
Not that way
Not goin out that way
I can't live without you
Can't be without you
I'm beggin' you to stay, to stay

[Chorus (Dru Hill):]
I love you
Even though I said that you should leave me
I want another chance just to adore you
I still believe in you and me, I love you
Won't you take the time (Love you)
Take the time to see (Leave me)
I don't wanna have to live my life in misery
I wasn't ready for you to set me free (Adore you), (I'm in love)
Don't give our love away

[Verse Two (Scola):]
Words can't describe how I feel about you
Only Heaven knows how much I do
Girl I'll put my own life on the line
I'd cherish and protect you with my life
All that s*** I said girl I didn't mean
I'd die without your love baby if you leave
I could let you walk away
But baby I'm not goin out that way

[Hook (Sisqo):]
Not that way
Not goin out that way
Cuz I can't live without you
Can't be without you
I'm beggin you to stay, oohhh

[Chorus (Dru Hill):]
I love you
Even though I said you should leave me (I was just bulls***tin baby)
I want another chance to adore you (I was just f***in around)
Cuz I still believe in you and me, yeah
Won't you take the time (Love you)
Take the time to see (Leave me) (take the time)
I don't wanna have to live my life in misery
I wasn't ready for you to set me free (Adore you) (I don't wanna live my life without you here

[Nokio:]
Might as well just kill me

[Bridge (Dru Hill):]
All My Life (all my, my life, I'd sacrifice for you)
Sacrifice (baby, I'd sacrifice for you, baby I'd sacrifice)
After that rising sun
Is another day begun
I won't live without you
Won't be without you
I'm beggin you to stay (Can't you just understand I just don't wanna be with you?)
Please stay

[Chorus (Dru Hill):]
I love you
Even though I said you should leave me
I want another chance just to adore you
(Gonna take my time, take my time, to give you the love that you want)
Won't you take the time (Love you)
Take the time to see (Leave me)
I don't wanna have to live my life in misery
I wasn't ready for you to set me free (Adore you)

Cuz I love you
I love you
I love you
I love you
I love you
I love you
I love you, baby
And I still believe in you and me

(I love you)
oh, I love you
I love you
I love you
I love you
I do
Waitin for you
For you, baby
I love you

[Nokio:]
We need each other
I taught you how to love
You taught me how to love
And from that we created love (I love you)
You stayed with me when I was doin' wrong
So why'd you leave me when I started doin right
The beauty's gone
I love you
I love you",2002
History,Funeral for a Friend,https://www.azlyrics.com/lyrics/funeralforafriend/history.html,"Dear friends of this academy
Oh, Romeo is bleeding to death..
To see a friend bleed to death
What for, some kind of metaphor
That I can't see..
So I'll drink until I see it.

This sky will make me sick,
So I'll give up on you,
I'll give up on this.
This sky will make me sick,
So I'll give up on this,
I'll give up on you.

[Chorus]
Archers in your arches,
Raise your fingers for one last salute..
And bleed this skyline dry
Your history is mine.

So you want to hold me up and bring me down?
Yes, you want to hold me up and break me down

I don't care for your sweet scent
Or the way you want me more than I want you.
I don't care for your sweet scent
Or the way you want me more than I want you.

[Chorus x2]

It's all mine.. it's all mine.. it's all mine...

[Chorus x2]",2005
Gotta Be Somebody's Blues,Jimmy Eat World,https://www.azlyrics.com/lyrics/jimmyeatworld/gottabesomebodysblues.html,"Let the water come
She's the only one I love
Let the fat man drop
She's the sweetest honey pot

Will they see the sky again?
Who will sing their blues for them?

Let the factories rust
She's the only thing I trust
Let the virus spread
She's the silk lining in my bed

Will they breathe our air again?
Who will sing their blues for them?

When you're feeling moot
You can have your conscience all you want
You can't say I do nothing yeah
I put it off

Where you gonna go if they come for you?
Will there be someone left to sing your blues?
Where you gonna run when they come for you?
Will there be someone to sing your blues?",2007
Don't Take the Girl,Tim McGraw,https://www.azlyrics.com/lyrics/timmcgraw/donttakethegirl.html,"Johnny's daddy was taking him fishin'
When he was eight years old
A little girl came through the front gate holdin' a fishing pole
His dad looked down and smiled, said we can't leave her behind
Son I know you don't want her to go but someday you'll change your mind
And Johnny said ""Take Jimmy Johnson, take Tommy Thompson, take my best friend Bo
Take anybody that you want as long as she don't go
Take any boy in the world
Daddy please don't take the girl

Same old boy
Same sweet girl
Ten years down the road
He held her tight and kissed her lips
In front of the picture show
Stranger came and pulled a gun
Grabbed her by the arm said ""If you do what I tell you to, there won't be any harm"" 
And Johnny said ""Take my money, take my wallet, take my credit cards
Here's the watch that my grandpa gave me
Here's the key to my car
Mister give it a whirl
But please don't take the girl

Same old boy
Same sweet girl
Five years down the road
There's going to be a little one and she says it's time to go
Doctor says the baby's fine but you'll have to leave
'Cause his momma's fading fast and Johnny hit his knees and there he prayed
Take the very breath you gave me
Take the heart from my chest
I'll gladly take her place if you'll let me
Make this my last request
Take me out of this world
God, please don't take the girl

Johnny's daddy
Was taking him fishin'
When he was eight years old",1994
