song,artist,url,lyrics,year
All the Pretty Horses,Calexico,https://www.azlyrics.com/lyrics/calexico/alltheprettyhorses.html,"Hush-a-bye, don't you cry
Go to sleep you little baby
When you wake, you shall have cake
And all the pretty little horses
Blacks and bays, dapple and greys
All the pretty little horses

Hmm, and mama loves, daddy loves
Oh they love their little baby
When you wake, you shall have cake
And all the pretty little horses
Blacks and bays, dapple and greys
All the pretty little horses
Blacks and bays, dapple and greys
Coach and six white horses

Way down yonder, down in the meadow
Lies a poor little child
The bees and the flies are pickin' out its eyes
The poor little child crying for its mother
Oh, crying for its mother

Hush-a-bye, don't you cry
Go to sleep you little baby
When you wake, you shall have cake
And all the pretty little horses
Blacks and bays, dapple and greys
Coach and six white horses
Blacks and bays, dapple and greys
All the pretty little horses
Blacks and bays, dapple and greys",2001
Have You Seen Her,The Chi-Lites,https://www.azlyrics.com/lyrics/chilites/haveyouseenher.html,"One month ago today
I was happy as a lark
But now I go for walks
To the movies, maybe to the park

And have a seat on the same old bench
To watch the children play, huh
You know, tomorrow is their future
But to me just another day

They all gather around me
They seem to know my name
We laugh, tell a few jokes
But it still doesn't ease my pain

Well, I know I can't hide from a memory
'Though day after day I've tried
I keep sayin' she'll be back
But today again I lied

Oh, I see her face everywhere I go
On the street and even at the picture show
Have you seen her?
Tell me, have you seen her?

Oh, I hear her voice as the cold winds blow
In the sweet music on my radio
Have you seen her?
Tell me, have you seen her?

Why, oh why
Did she have to leave and go away, oh yeah
Oh, I've been used to havin' someone to lean on
And I'm lost
Baby, I'm lost

Oh doo-doo-doo-doo-doo-doo
Have you seen her?
Tell me, have you seen her?

Oh doo-doo-doo-doo-doo-doo
Have you seen her?
Tell me, have you seen her?

Oh, she left her kiss upon my lips
But left that break within my heart
Have you seen her?
Tell me, have you seen her?

Oh, I see her hand reaching out to me
Only she can set me free
Have you seen her?
Tell me, have you seen her?

Why oh why?
Did you have to leave and go away? Oh yeah
Ooh oh, I've been used to having someone to lean on
And I'm lost, baby I'm lost

Oh doo-doo-doo-doo-doo-doo
Have you seen her?
Tell me, have you seen her?

As another day comes to an end
I'm lookin' for a letter or somethin'
Anything that she would send
With all the people I know
I'm still a lonely man
You know, it's funny
But I thought I had her in the palm of my hand

Have you seen her
Tell me, have you seen her (tell me, have you seen her?)

Oh doo-doo-doo-doo-doo-doo
Have you seen her?
Tell me, have you seen her?
Have you seen her?
Tell me, have you seen her?
Have you seen her?
Tell me, have you seen her?",1971
These Are the Fables,The New Pornographers,https://www.azlyrics.com/lyrics/newpornographers/thesearethefables.html,"In coral and gray
In submarine chambers
One day
It swam for the light
The jewels that lit
The cities that float there
Cities in circles drawn perfect, complete
Holding the secrets on my street
My street, my street

So come in and play
The song of the siren
It's commonplace
You hear the voice rise
In one wave
And crash on your doorstep
Making the circle here perfect, complete
These are the fables on my street

Ten thousand dancing girls
Kicking cans 'cross the sky
No reason why
Why ask to pay yourself
For the call of the wild
You found this child
So raise him

And wind your back
Come back to the river
The currents speed by
And hope the men fear
The hammer comes down
So hard on the evening
Cracking the dawn of your
Days are repeat
These are fables on my street
My street, my street

Heaven shook Hell
And down from its pockets
The ring in your bell
It fell through your hands
Hang at your feet
The doors that won't open
Marking the journey of our friends complete
These are the fables of my street
My street

My street, my street
Lay down in glory, you're not alone

My street, my street
Lay down in glory, you're not alone",2005
The Animals of the World,Great Lake Swimmers,https://www.azlyrics.com/lyrics/greatlakeswimmers/theanimalsoftheworld.html,"Watching the night animals
bellying close to the ground
I was walking in the dark
It was following some feral scent
Like I was crossing the road
Like I was
Following those streets to their destinations

And the animals of the world
And the animals of the world
Find theirs

And when the wind stops
We all stop and we are silent
And in the end we all will bend
We will break away
From the ox head
We are moths around a porch light
We're covered in jars
Or pinned to the wall
Dried out and displayed
Tired out and dismayed
From riding on the winds
Biding the tides
Riding the winds
Or biding the tides

Flying with the sun
Or perched in a row
I was at a window sill
They were unaware like I was
A moment there and then gone
Like I was
Looking for a place to rest

And the animals of the world
And the animals of the world
Find theirs

And when the wind stops
We all stop and we are silent
And in the end
We all will bend
We will break away
From the ox head
We are moths around a porch light
We're covered in jars
Or pinned to the wall
Dried out and displayed
Tired out and dismayed
From riding on the wheels
Biding the streets
Riding the wheels
Or biding the streets",2003
Fly,Nick Drake,https://www.azlyrics.com/lyrics/nickdrake/fly.html,"Please give me a second grace,
Please give me a second face,
I've fallen far down, the first time around, 
Now I just sit on the ground in your way

Now, if it's time for recompense for what's done,
Come, come sit down on the fence in the sun,
And the clouds will roll by and we'll never deny,
It's really too hard for the fly

Please tell me your second name, 
Please play me your second game,
I've fallen so far, of the people you are, 
I just need your star for a day

So come, come ride in my street-car by the bay,
For now, I must know how fine you are in your way,
And the sea she will sigh but she'll never deny, 
For it's really too hard for the fly",1970
Maybe Sparrow,Neko Case,https://www.azlyrics.com/lyrics/nekocase/maybesparrow.html,"Maybe sparrow you should wait
The hawks alight till morning
You'll never pass beyond the gate
If you don't hear my warning

Notes are hung so effortless
With the rise and fall of sparrow's breast
It's a drowning dive and back to the chorus

La di da di da di da
La di da di da di da

Oh my sparrow it's too late
Your body limp beneath my feet
Your dusty eyes cold as clay
You didn't hear my warning

Maybe sparrow it's too late
Moonlight glanced off metal wings
In a thunderstorm above the clouds
The engine hums a sparrow's phrase
For those who cannot hear the words
For those who will not hear the words
For those who will not hear the words

La di da di da di da
La di da di da di da

Maybe sparrow
Maybe sparrow
Maybe sparrow",2006
Thirteen,Big Star,https://www.azlyrics.com/lyrics/bigstar/thirteen.html,"Won't you let me walk you home from school?
Won't you let me meet you at the pool?
Maybe Friday I can
Get tickets for the dance
And I'll take you, ooh ooh

Won't you tell your dad get off my back?
Tell him what we said 'bout Paint It Black
Rock and roll is here to stay
Come inside where it's okay
And I'll shake you, ooh ooh

Won't you tell me what you're thinking of?
Would you be an outlaw for my love?
If it's so, well let me know
If it's no, well I can go
I won't make you, ooh ooh",1972
Bloody Murderer,Cursive,https://www.azlyrics.com/lyrics/cursive/bloodymurderer.html,"There's a ghost in my bed
she cries in her sleep
she says I won't let her leave
I lie perfectly still
as she stifles her tears
I don't want to disturb her

'Let go, let go - please let me be
Look at the ghost you've made of me'

Dusk dropped her starry gown
I whispered out
""Sweetie, are you here with me?""
the mirror crashed on the dresser
and she began to scream
""Bloody murderer! Let me rest in peace!""
""When I was yours, you fled the scene,
now you can't wash your hands of me.""

Bloody murder
You can't hear the screams",2003
Red Berries,Angus & Julia Stone,https://www.azlyrics.com/lyrics/angusjuliastone/redberries.html,"I ate the red berries
And fell into the pond
I found myself in a dream
Where all my worries were gone

So I swam up to the top
And strolled up into a land
If people aren't who they're not
I thought wouldn't that be grand?
Wouldn't that be grand?

Birds don't whistle, they just sing
Birds don't whistle, they just sing
Things just start as they sing
Birds don't whistle, they just sing

They sung this song

I ate the red berries
The ones you told to leave alone
On the devil's shoulder I leaned
As I fell through the clouds like a storm

So I climbed up to the top
And jumped off into a land
If people aren't who they're not
I thought wouldn't that be grand?
Wouldn't that be grand?

Birds don't whistle, they just sing
Birds don't whistle, they just sing
Things just start as they sing
Birds don't whistle, they just sing

They sung this song",2010
Confessions,Peter Murphy,https://www.azlyrics.com/lyrics/petermurphy/confessions.html,"I could use your gullibility
Distort the painful truth
Present a fear and laugh at you
Leave you lost unsure removed
The must I feel to put it right
Put an end to naive faith
In slick successes avenue
The vacuum of save face

Direct words can turn lost minds
Towards some monster seed
Lyrics sung from pretty looks
Can on the reader feed
Be strong to check and recognise
The pretty face is all
But being used to sell you songs
That never say it all

The incident meets the senses
The illusions in a mask
The sun of a summer afternoon
Docility rocks the mask
Broken loose from moorings
In a flash the swell had passed
Towards the beach with unabated speed
Confessions of a mask",1986
Lethal Enforcer,We Are Scientists,https://www.azlyrics.com/lyrics/wearescientists/lethalenforcer.html,"You're never gonna understand what you're seeing
But later you'll pretend you can and you'll mean it
You might think it's all in your head but you're not certain anymore
You might think it's all in your head but you're not certain anymore

I wouldn't put much talk in that 'cause the fact is
It doesn't matter what you ask, it's who you're asking
Well I'd say go throw it away if it's not working anymore
Well I'd say go throw it away if it's not working anymore

I promise this is not a test, it just I want you to be sure
It all comes back to common sense, I guess that's what you're looking for
I'll have to ask you to speak up so we're sure that
We're all perfectly clear on what we're ignoring
Well I'd say go throw it away if it's not working anymore
Well I'd say go throw it away if it's not working anymore

I promise this is not a test, it's just I want you to be sure
It all comes back to common sense, I guess that's what you're looking for
I promise this is not a test, it's just I want you to be sure
It all comes back to common sense, I guess that's what you're looking for

Well you've been taken and it's gonna hurt
Love's a classic 'cause it always works
This is a classic bluff because it always works on you

I promise this is not a test
A test
I promise this is not a test

I promise this is not a test, it's just I want you to be sure
It all comes back to common sense, I guess that's what you're looking for
I promise this is not a test, it's just I want you to be sure
It all comes back to common sense, I guess that's what you're looking for",2008
Prison Girls,Neko Case,https://www.azlyrics.com/lyrics/nekocase/prisongirls.html,"Where am I tonight? La, da, da 
My hotel room won't remember me 
And this dream will die, die by morning 
And this dream won't remember me 

Awakened by a droning voice 
I love your long shadows and your gunpowder eyes 
Is it a lady or is it a man 
Humming helicopters through the blades of a fan 

I love your long shadows and your gunpowder eyes 
I love your long shadows and your gunpowder eyes 

On my feet to chase it down 
The lights were spokes and rungs away 
I stumbled back and hit the floor 
Long shadows crawl beneath the door 
To a passage so poorly lit 
There's moths flying away from it 

Who am I tonight? La, da, da 
My hotel room won't remember me 
Darkness enter prison girls 
Pushing mops and kicking pails 
Now's my chance 
I clasp my chest 
And declare unto my audience 
I love your long shadows and your gunpowder eyes 
I love your long shadows and your gunpowder eyes 

Prison girls are not impressed 
They're the ones that have to clean this mess 
They've traded more for cigarettes 
Than I've managed to express 

Filing past miles long 
The cheek is frozen to the floor 
The prison girls have filled their beds 
Their thoughts too dry above their heads 

I love your long shadows and your gunpowder eyes",2009
It's My Party,Bryan Ferry,https://www.azlyrics.com/lyrics/bryanferry/itsmyparty.html,"Nobody knows where my Johnny has gone
But Judy left the same time
Why was he holding her hand
When he's supposed to be mine
It's my party and I'll cry if I want to
Cry if I want to, cry if I want to
You would cry too, if it happened to you
Play all my records, keep dancing all night
But leave me alone for a while
'Til Johnny's dancing with me
I have no reason to smile
It's my party and I'll cry if I want to
Cry if I want to, cry if I want to
You would cry too if it happened to you
Judy and Johnny just walked through that door
But like a queen with her king
Oh, what a birthday surprise
Judy's wearing his ring
It's my party, and I'll cry if I want to
Cry if I want to, cry if I want to
You would cry too if it happened to you",1973
Sad Songs And Waltzes,Willie Nelson,https://www.azlyrics.com/lyrics/willienelson/sadsongsandwaltzes.html,"I'm writing a song all about you a true song as real as my tears
But you've no need to fear it cause no one will hear it
Cause sad songs and waltzes aren't selling this year
I'll tell all about how you cheated I'd like to the whole world to hear
I'd like to get even with you cause you're leavin'
And songs and waltzes aren't selling this year
It's a good thing that I'm not a star you don't know how lucky you are
Though my record may say it no one will play it
Cause sad songs and waltzes aren't selling this year
[steel]
Well it's a good thing...",1973
Roses Blue,Joni Mitchell,https://www.azlyrics.com/lyrics/jonimitchell/rosesblue.html,"I think of tears, I think of rain on shingles
I think of rain, I think of roses blue
I think of Rose, my heart begins to tremble
To see the place she's lately gotten to
Gotten to, gotten to

She's gotten to mysterious devotions
She's gotten to the zodiac and Zen
She's gotten into tarot cards and potions
She's laying her religion on her friends
On her friends, on her friends

Friends who come to ask her for their future
Friends who come to find they can't be friends
Because of signs and seasons that don't suit her
She'll prophesy your death, she won't say when
Won't say when, won't say when

When all the black cards come you cannot barter
No, when all your stars are stacked you cannot win
She'll shake her head and treat you like a martyr
It is her blackest spell she puts you in
Puts you in, puts you in

In sorrow she can lure you where she wants you
Inside your own self-pity there you swim
In sinking down to drown her voice still haunts you
And only with your laughter can you win
Can you win, can you win

You win the lasting laurels with your laughter
It reaches like an arm before you sink
To win the solitary truth you're after
You dare not ask the priestess how to think
How to think, how to think

I think of tears, I think of rain on shingles
I think of rain, I think of roses blue
I think of Rose, my heart begins to tremble
To see the place she's lately gotten to
Gotten to, gotten to",1969
Dear Chicago,Ryan Adams,https://www.azlyrics.com/lyrics/ryanadams/dearchicago.html,"Dear Chicago, 
You'll never guess. 
You know the girl you said I'd meet someday? 
Well, I've got something to confess. 
She picked me up on Friday. 
Asked me if she reminded me of you. 
I just laughed and lit a cigarette, 
Said ""that's impossible to do."" 
My life's gotten simple since. 
And it fluctuates so much. 
Happy and sad and back again. 
I'm not crying out to much. 
Think about you all the time. 
It's strange and hard to deal. 
Think about you lying there. 
And those blankets lie so still. 
Nothing breathes here in the cold. 
Nothing moves or even smiles. 
I've been thinking some of suicide. 
But there's bars out here for miles. 
Sorry about the every kiss. 
Every kiss you wasted (bad / back)
I think the thing you said was true, 
I'm going to die alone and sad. 

The wind's feeling real these days. 
Yeah, baby, it hurt's me some. 
Never thought I'd feel so blue. 
New York City, you're almost gone. 
I think that I've fallen out of love, 
I think I've fallen out of love . . . with you.",2002
Somebody Already Broke My Heart,Sade,https://www.azlyrics.com/lyrics/sade/somebodyalreadybrokemyheart.html,"[1] - You came along when I needed a savior
Someone to pull me through somehow
I've been torn apart so many times
I've been hurt so many times before
So I'm counting on you now

Somebody already broke my heart
Somebody already broke my heart

Here I am
So don't leave me stranded
On the end of a line
Hanging on the edge of a lie
I've been torn apart so many times 
I've been hurt so many times before
So be careful and be kind

[2] - Somebody already broke my heart
If someone has to lose, I don't want to play
Somebody already broke my heart
No, no I can't go there again

[Repeat 1]
[Repeat 2]",2000
Calm Under the Waves,Maria Mena,https://www.azlyrics.com/lyrics/mariamena/calmunderthewaves.html,"I walk barefoot where the water drowns the sand
with you no longer here to hold my hand

I let go
I let go

The ocean makes my swelling heart feel small
With the sounds it makes you won't hear it if I call
I let go
I let go

There's a breeze in the air
There's a boat anchored out here
There's a calm under the waves so I choose to sink

Your skin protected me from sunbeams
Your hands made sure I'd stay intact
I let go
I let go

You were always there to walk me home
With you not here, the streets I roam
I let go
I let go

There's a breeze in the air
There's a boat anchored out here
There's a calm under the waves as I choose to sink
With your voice in my head
I would float here instead
But there's a calm under the waves
So I choose to sink

I'm tired now
I'll see you when I wake up
I've heard it's pretty where you are
I let go
I let go
There's a breeze.",2006
I Turned You Down,Riverside,https://www.azlyrics.com/lyrics/riverside/iturnedyoudown.html,"I turned you down so hastily
And it's tearing me apart
In my heart of hearts I'm screaming
In my heart of hearts I cry
And it's cold
So cold

I turned you down
Oh, I turned you down so thoughtlessly
And it's tearing me apart
In my heart of hearts I'm screaming
In my heart of hearts I cry
How, I wish you told me that

I wish you'd told me that before
I wish you'd told me that before
I wish you'd told me that before
I turned you down

(Down, down, down
I turned you...)

(I wish you'd told me that before)

I wish you'd told me that before
I wish you'd told me that before
I wish you'd told me that before",2005
Crawling Up a Hill,Katie Melua,https://www.azlyrics.com/lyrics/katiemelua/crawlingupahill.html,"Every morning (a)bout half past eight, 
My Mummer wakes me says, 
""Don't be late"", 
Get to the office, tryin' to concentrate, 
My life is just a slow train crawling up a hill. 

So I stop one day to figure it out, 
I'll quit my job without a shadow of a doubt, 
To sing the blues that I know about, 
My life is just a slow train crawling up a hill. 

Minute after minute, 
Second after second, 
Hour after hour goes by, 
Working for a rich girl, 
Staying just a poor girl, 
Never stop to wonder why. 

So here I am in London town, 
A better scene IÃ¼m gonna be around, 
The kind of music that won't bring me down, 
My life is just a slow train crawling up a hill. 

Every morning (a)bout half past eight, 
My Mummer wakes me says, 
""Don't be late"", 
I get to the office, tryin' to concentrate, 
My life is like a slow train crawling up a hill. 

So I stop one day to figure it out, 
I'll quit my job without a shadow of a doubt, 
To sing the blues that I know about, 
My life is just a slow train crawling up a hill. 

Minute after minute, 
Second after second, 
Hour after hour goes by, 
Working for a rich girl, 
Staying just a poor girl, 
Never stop to wonder why. 

So here I am in London town, 
A better scene I'm gonna be around, 
The kind of music that won't bring me down, 
Life is just a slow train. 

So here I am in London town, 
A better scene I'm gonna be around, 
The kind of music that won't bring me down, 
My life is just a slow train crawling up a hill",2003
Stay Together,Suede,https://www.azlyrics.com/lyrics/suede/staytogether.html,"Come to my house tonight,
We can be together in the nuclear sky.    
We wildance in the poison rain,    
We can stay a while in heaven today.

[CHORUS]

Stay together
And say, these days ??

Stay together
Two hearts under the skies remain.

There's a time bomb in the high ?life?
There's a blue suburban dream.
Will I see you up in paradise?
Or have you come to touch me?

Come to my arms tonight,
You and me together on electric light.
She will dance in the poisoned air,
Just you and me forever by the motorway ??

[CHORUS]

Come to my arms or not,
Just you and me together in the year of the hawk.
Single file in the nuclear night,
And we can feel a little closer as we tumble through the sky.

[CHORUS]

[REPEAT CHORUS]",
Everything's Not Lost,Coldplay,https://www.azlyrics.com/lyrics/coldplay/everythingsnotlost.html,"When I counted up my demons
Saw there was one for every day
With the good ones on my shoulder
I drove the other ones away

So if you ever feel neglected
And if you think all is lost
I'll be counting up my demons, yeah
Hoping everything's not lost

When you thought that it was over
You could feel it all around
Everybody's out to get you
Don't you let it drag you down

'Cause if you ever feel neglected
If you think all is lost
I'll be counting up my demons, yeah
Hoping everything's not lost

If you ever feel neglected
If you think that all is lost
I'll be counting up my demons, yeah
Hoping everything's not lost

Singing out oh oh oh yeah
Oh oh yeah
Oh oh yeah
Everything's not lost

So come on yeah
Oh oh yeah
Come on yeah
Everything's not lost
Oh oh oh yeah
Oh oh yeah
Oh oh yeah
And everything's not lost
Come on yeah
Oh oh yeah
Come on yeah
Come on yeah
Oh oh yeah
Come on yeah
Everything's not lost
Sing out yeah
Oh oh yeah
Come on yeah
Everything's not lost
Come on yeah
Oh oh yeah
Sing out yeah
Everything's not lost",2000
Sad Professor,R.E.M.,https://www.azlyrics.com/lyrics/rem/sadprofessor.html,"If we're talking about love
Then I have to tell you
Dear readers, I'm not sure where I'm headed.
I've gotten lost before.
I've woke up stone drunk
Face down in the floor.

Late afternoon, the house is hot.
I started, I jumped up.
Everyone hates a bore.
Everybody hates a drunk.

This may be a lit invention
Professors muddled in their intent
To try to rope in followers
To float their malcontent.
As for this reader,
I'm already spent.

Late afternoon, the house is hot.
I started, I jumped up.
Everyone hates a sad professor.
I hate where I wound up.

Dear readers, my apologies.
I'm drifting in and out of sleep.
Long silence presents the tragedies
Of love. Note the age. Get afraid.
The surface hazy with attendant thoughts.
A lazy eye metaphor on the rocks.

Late afternoon, the house is hot.
I started, I jumped up.
Everyone hates a bore.
Everybody hates a drunk.
Everyone hates a sad professor.
I hate where I wound up.
I hate where I wound up.",1998
In Limbo,Radiohead,https://www.azlyrics.com/lyrics/radiohead/inlimbo.html,"I'm the first in the Irish Sea
Another message I can't read

I'm on your side
Nowhere to hide
Trapdoors that open
I spiral down

You're living in a fantasy world
You're living in a fantasy world

I'm lost at sea
Don't bother me
I've lost my way
I've lost my way

You're living in a fantasy world [x3]
This beautiful world I'm the first in the Irish Sea
Another message I can't read",2000
