song,artist,url,lyrics,year
Last Flowers,Radiohead,https://www.azlyrics.com/lyrics/radiohead/lastflowers.html,"Appliances have gone berserk
I cannot keep up
Treading on people's toes
Snot-nosed little punk

And I can't face the evening straight
You can offer me escape
Houses move and houses speak
If you take me there you'll get relief
Relief, relief, relief, relief...

And if I'm gonna talk
I just wanna talk
Please don't interrupt
Just sit back and listen

'Cause I can't face the evening straight
You can offer me escape
Houses move and houses speak
If you take me there you'll get relief
Relief, relief, relief, relief...

It's too much
Too bright
Too powerful

Too much
Too bright
Too powerful

Too much
Too bright
Too powerful

Too much
Too bright
Too powerful",2007
Somewhere In My Broken Heart,Billy Dean,https://www.azlyrics.com/lyrics/billydean/somewhereinmybrokenheart.html,"You made up your mind it was time it was over
After we had come so far
I think there's enough pieces of forgiveness
Somewhere in my broken heart

I would not have chosen the road you have taken
It has left us miles apart
I think I can still find the will to keep going
Somewhere in my broken heart

So fly, go ahead and fly
Till you find out who you are
And I, I will keep my love unspoken
Somewhere in my broken heart

I hope that in time you will find what you long for
Love that's written in the stars
When you finally do, I think you will see
It's somewhere in my broken heart

Girl, I, I will keep my love unspoken
Somewhere in my broken heart

I hope that in time you will find what you long for
Love that's written in the stars
When you finally do, I think you will see 
It's somewhere in my broken
Somewhere in my broken
Somewhere in my broken heart",1990
When It Rains,Paramore,https://www.azlyrics.com/lyrics/paramore/whenitrains.html,"And when it rains
On this side of town it touches, everything
Just say it again and mean it
We don't miss a thing
You made yourself a bed
At the bottom of the blackest hole (blackest hole)
And convinced yourself that
It's not the reason you don't see the sun anymore

And no, oh, how could you do it?
Oh I, I never saw it coming
No, oh, I need the ending
So why can't you stay
Just long enough to explain?

And when it rains
You always find an escape
Just running away
From all of the ones who love you
From everything
You made yourself a bed
At the bottom of the blackest hole (blackest hole)
And you'll sleep 'til May
And you'll say that you don't wanna see the sun anymore

And no, oh, how could you do it?
Oh I, I never saw it coming
And no, oh, I need the ending
So why can't you stay just long enough to explain?

Take your time
Take my time

Take these chances to turn it around (take your time)
Take these chances, we'll make it somehow
And take these chances to turn it around (take my...)
Just turn it around

No, how could you do it?
Oh I, I never saw it coming
No, oh, how could you do it?
Oh I, I never saw it coming
No, oh, how could you do it?
Oh I, I never saw it coming
No, oh I need an ending
So why can't you stay
Just long enough to explain?

You could take your time
Take my time",2007
Here Comes Goodbye,Rascal Flatts,https://www.azlyrics.com/lyrics/rascalflatts/herecomesgoodbye.html,"I can hear the truck tires coming up the gravel road
And its not like her to drive that slow, nothin's on the radio
Footsteps on the front porch, I hear my doorbell
She usually comes right in, now I can tell

[Chorus]
Here comes goodbye
Here comes the last time
Here comes the start of every sleepless night
The first of every tear I'm gonna cry
Here comes the pain 
Here comes me wishing things had never changed
And she was right here in my arms tonight, but here comes goodbye

I can hear her say I love you like it was yesterday
And I can see it written on her face that she had never felt this way
One day I thought I'd see her with her daddy by her side
And violins would play here comes the bride

[Chorus]
Here comes goodbye
Here comes the last time
Here comes the start of every sleepless night
The first of every tear I'm gonna cry
Here comes the pain 
Here comes me wishing things had never changed
And she was right here in my arms tonight, but here comes goodbye

Why does it have to go from good to gone?
Before the lights turn on, yeah and you're left alone
All alone, but here comes goodbye

Oh-oooo

[Chorus]
Here comes goodbye 
Here comes the last time
Here comes the start of every sleepless night
The first of every tear I'm gonna cry
Here comes the pain 
Here comes me wishing things had never changed
And she was right here in my arms tonight, but here comes goodbye

Oh-oooo",2009
Nights Like This,After 7,https://www.azlyrics.com/lyrics/after7/nightslikethis.html,"Shu bee doop do do doo oooo....
Shu bee doop do do doo
Shu bee doop do do doo oooo....
Shu bee doop do do doo

I could feel that it was over
Your love for me
Why couldn't you tell me you had
Another on your mind?
Its no way to treat me when you know
How I feel inside

I could not hide the way I felt last nite.
Tears I cried
My love for you I can't deny no no no no

Nights like this I wish
Rain drops would fall(yes I do hey baby ooo)
Nights like this I wish that
Rain drops would fall

Girl now I know what been goin' on
You got another lover and you got it goin' strong
Been walkin' round town with a smile on my face
Tryin' to fight the hurt tryin' to hide the shame baby

I can not cry no more,
Now I realize
I was too blind baby
Bein' a fool in love you
Know it ain't right girl
If you really wanna be
In happy baby

Nights like this I wish
Rain drops would fall (yes I do hey baby ooo)
Nights like this I wish that
Rain drops would fall

Yeah yeah oh how I wish rain drops would fall on my face babe)
Hey ohhhh ohhhh
Rain rain baby rain drops on my face baby

Ooooo ooooo day I cried

I could feel when every thing was not to real
Inside I cried to win your love you know I tried

Come one go on keep rain drops fallin' on my face baby
Eh come on come on yeah
Hey let them fall baby",
I Can't Unlove You,Kenny Rogers,https://www.azlyrics.com/lyrics/kennyrogers/icantunloveyou.html,"Postcards and letters
And pictures made to last forever
To be boxed up and tossed away
Knickknacks and souvenirs
In an afternoon, they're out of here
They'll disappear without a trace
But what they mean to me
Can never be replaced

I can't unthink about you
I can't unfeel your touch
I can't unhear all the words
Unsay all the things
That used to mean so much
I wish I could unremember
Everything my heart's been through
And finding out it's impossible to do
Oh, it's no use
I can't unlove you

Interstates and old songs
Like time they go on and on
I guess I could learn to do the same
I could wake up without you
These two arms not around you
Tell myself it's meant to be this way
No matter how I try somethings I can't change

I can't unthink about you
I can't unfeel your touch
I can't unhear all the words
Unsay all the things
That used to mean so much
I wish I could unremember
Everything my heart's been through
And finding out it's impossible to do
Oh, no
Oh, it's no use
I can't unlove you

I wish I could unremember
Everything my heart's been through
And finding out it's impossible to do
Oh, oh, it's no use
I can't unlove you",2006
Run Joey Run,Glee Cast,https://www.azlyrics.com/lyrics/gleecast/runjoeyrun.html,"Daddy please don't
It wasn't his fault
He means so much to me
Daddy please don't
We're gonna get married
Just you wait and see

Every night, the same old dream
I hate to close my eyes
I can't erase the memory
The sound of Julie's cry

She called me up, late that night
She said, ""Joe, don't come over
My Dad and I just had a fight
And he stormed out the door

I've never seen him act this way
My God, he's goin' crazy
He said he's gonna make you pay
For what we done, he's got a gun
So run, Joey run, Joey run!""

Daddy please don't
It wasn't his fault
He means so much to me
Daddy please don't
We're gonna get married
Just you wait and see

Got in my car, drove like mad
'Til I reached Julie's place
She ran to me, with tear-filled eyes
And bruises on her face

All at once I saw him there
Sneakin' up behind me (Watch out!)
Then Julie yelled, ""He's got a gun!""
And she stepped in front of me

Suddenly, a shot rang out
And I saw Julie falling
I ran to her, I held her close
When I looked down, my hands were red!
And here's the last words Julie said...

Daddy please don't
It wasn't his fault
He means so much to me
Daddy please don't
We're gon...na get... mar...ried...

Run, Joey run, Joey run, Joey run, Joey run, Joey run, Joey run!",
Tear,The Smashing Pumpkins,https://www.azlyrics.com/lyrics/smashingpumpkins/tear.html,"The lights came on fast 
Lost in motorcrash 
Gone in a flash unreal 
But you knew all along 
You laugh the light 
I sing the songs 
To watch you numb 

I saw you there 
You were on your way 
You held the rain 
And for the first time 
Heaven seemed insane 
Cause heaven is to blame 
For taking you away 

Do you know the way that I can? 
Do you know the way that I can't lose? 
Do you know the things that I can? 
Do you know the things that I can do? 

Where is your heart? where is your heart gone to? 
Tear me apart 
Tear me apart from you 
You laugh the light I cry the wound 
In gray afternoons 

I saw you there 
You were on your way 
You held the rain 
And for the first time 
Heaven seemed insane 
Cause heaven is to blame 
For taking you away 

The lights came to pass 
Dead opera motorcrash 
Gone in a flash unreal 
In nitrous overcast 

Do you know the way that I can? 
Do you know the way that I can't choose? 
Do you know the things that I can? 
Do you know the things that I can't lose? 

Tear me apart 
Tear me apart from you 
Where is your heart? 
Where has your heart run to?",1998
Ghost in This House,Alison Krauss,https://www.azlyrics.com/lyrics/alisonkrauss/ghostinthishouse.html,"I don't pick up the mail
I don't pick up the phone
I don't answer the door
I'd just as soon be alone
I don't keep this place up
I just keep the lights down
I don't live in these rooms
I just rattle around

I'm just a ghost in this house
I'm just a shadow upon these walls
As quietly as a mouse I haunt these halls
I'm just a whisper of smoke
I'm all that's left of two hearts on fire
That once burned out of control
You took my body and soul
I'm just a ghost in this house

I don't care if it rains
I don't care if it's clear
I don't mind staying in
There's another ghost here
He sits down in your chair
And he shines with your light
And he lays down his head
On your pillow at night

I'm just a ghost in this house
I'm just a shadow upon these walls
I'm living proof of the damage
Heartbreak does
I'm just a whisper of smoke
I'm all that's left of two hearts on fire
That once burned out of control
And took my body and soul
I'm just a ghost in this house
Oh, I'm just a ghost in this house",1999
Harder Now That It's Over,Ryan Adams,https://www.azlyrics.com/lyrics/ryanadams/hardernowthatitsover.html,"They slapped 'em on you 
Where that bracelet used to be 
You know the one I bought you in phoenix 
Where they sell old jewelry 
I was trying to make you angry 
But I didn't feed you to the cops 
When I threw that drink in that guy's face 
It was just to piss you off 
'Cause honey it's over 

It's harder now that it's over 
It's harder now that it's over 
Now that the cuffs are off 
And you're free 
You're free with a history 

I heard your wrists got bruised 
Must've felt just like old times 
I wish you would've grabbed the gun 
And shot me 'cause I died 
And I'm nothing now without you 
yeah, I'm less than nothing now 

I'm the one between the bars and lost forever now 
'Cause it's over now 

It's harder now that it's over 
It's harder now that it's over 
Now that the cuffs are off 
And you're free 
You're free with a history 

Free with a history 
You're free 
Free with a history 

I'm sorry",2001
Everything,Lifehouse,https://www.azlyrics.com/lyrics/lifehouse/everything.html,"Find me here
And speak to me
I want to feel you
I need to hear you
You are the light
That's leading me
To the place
Where I find peace again

You are the strength
That keeps me walking
You are the hope
That keeps me trusting
You are the light
To my soul
You are my purpose
You're everything

How can I stand here with you
And not be moved by you?
Would you tell me
How could it be
Any better than this?

You calm the storms
And you give me rest
You hold me in your hands
You won't let me fall
You steal my heart
And you take my breath away
Would you take me in
Take me deeper now

And how can I stand here with you
And not be moved by you?
Would you tell me
How could it be
Any better than this?

And how can I stand here with you
And not be moved by you?
Would you tell me
How could it be
Any better than this?

Cause you're all I want
You're all I need
You're everything, everything

You're all I want
You're all I need
You're everything, everything

You're all I want
You're all I need
You're everything, everything

You're all I want
You're all I need
You're everything, everything

And how can I stand here with you
And not be moved by you?
Would you tell me
How could it be
Any better than this?

And how can I stand here with you
And not be moved by you?
Would you tell me
How could it be
Any better, any better than this?

And how can I stand here with you
And not be moved by you
Would you tell me
How could it be
Any better than this?

Would you tell me
How could it be
Any better than this",2000
Book of Saturday,King Crimson,https://www.azlyrics.com/lyrics/kingcrimson/bookofsaturday.html,"If I only could deceive you
Forgetting the game
Every time I try to leave you
You laugh just the same

'Cause my wheels never touch the road
And the jumble of lies we told
Just returns to my back to weigh me down...

We lay cards upon the table
The backs of our hands
And I swear I like your people
The boys in the band

Reminiscences gone astray
Coming back to enjoy the fray
In a tangle of night and daylight sounds...

All completeness in the morning
Asleep on your side
I'll be waking up the crewmen
Banana-boat ride

She responds like a limousine
Brought alive on the silent screen
To the shuddering breath of yesterday...

There's the succour of the needy
Incredible scenes
I'll believe you in the future
Your life and death dreams

As the cavalry of despair
Takes a stand in the lady's hair
For the favour of making sweet sixteen...

You make my life and times
A book of bluesy Saturdays
And I have to choose...",1973
Where Will You Go,Babyface,https://www.azlyrics.com/lyrics/babyface/wherewillyougo.html,"We started out simple friends
That kind of friendship never ends, no baby
But we were fortunate to care enough
We knew just where we stood
But soon as love appeared
You turned away
And you were so unsure and so afraid
Of feeling what I was feeling
You were scared that love
Would blow your heart away
And you were certain that
In time my love would stray

Where, where will you go
And who, who's gonna love you like I do
Where, where will you go
And who's gonna love like I do

What kind of friends could we have been
If we had kept the feelings in
When we had made a vow to be the friends
We were since we began
But soon as love appeared
You turned away
And you were so unsure and so afraid
Of feeling what I was feeling
You were scared that love
Would blow your heart away
And you were certain that
In time my love
You were thinkin' that our love was gonna stray
Oh tell me

Where, where will you go
And who, who's gonna love you baby
The way that I do, now baby
Where, where will you go, where will you go
And tell me who is gonna love
I wanna know who is gonna love
I need to know who's gonna love
Who's gonna love, who, who, who, oh

Where, where will you go, baby
Who's gonna love you baby, tell me
Who's gonna care for you baby
Who's gonna be there for you baby
Who's gonna love you like you need to be loved
Oh where will you go, baby
And who's gonna love you like I do

Oh I wanna know I wanna know I wanna know
Like I do",1989
Missing You,Case,https://www.azlyrics.com/lyrics/case/missingyou.html,"Standing here looking out my window
My nights are long and my days are cold
Cause I don't have you
How can I be so damn demanding?
I know you said that it's over now
But I can't let go

[1] - Every day I want to pick up the phone
And tell you that 
You're everything I need and more
If only I could find you

[2] - Like a cold Summer afternoon
Like the snow coming down in June
Like a wedding without a groom
I'm missing you
I'm the desert without the sand
You're the woman without a man
I'm a ring without a hand
I'm missing you

Driving 'round thought I saw you pass me
My rearview mirror's playing tricks on me
Cause you fade away
Maybe I'm just hallucinating
Cause my loneliness got the best of me
And my heart's so weak

[Repeat 1]

[Repeat 2]

Yeah, yeah, yeah, yeah
Yeah, yeah, yeah, yeah
Yeah, yeah, yeah, yeah
Yeah, yeah, yeah, yeah
Said I'm, I'm missing you

[Repeat 2 (2x)]

Yeah, yeah, yeah, yeah
Yeah, yeah, yeah, yeah
Yeah, yeah, yeah, yeah
Yeah, yeah, yeah, yeah
Yeah, yeah, yeah, yeah
Yeah, yeah, yeah, yeah...",2001
Whatsername,Green Day,https://www.azlyrics.com/lyrics/greenday/whatsername.html,"Thought I ran into you down on the street
Then it turned out to only be a dream
I made a point to burn all of the photographs
She went away and then I took a different path

I remember the face but I can't recall the name
Now I wonder how whatsername has been

Seems that she disappeared without a trace
Did she ever marry old what's his face?
I made a point to burn all of the photographs
She went away and then I took a different path

I remember the face but I can't recall the name
Now I wonder how whatsername has been

Remember, whatever
It seems like forever ago
Remember, whatever
It seems like forever ago
The regrets are useless
In my mind
She's in my head
I must confess
The regrets are useless
In my mind
She's in my head
From so long ago

(Go, go, go, go)

And in the darkest night
If my memory serves me right
I'll never turn back time
Forgetting you, but not the time.",2004
Ribbons Undone,Tori Amos,https://www.azlyrics.com/lyrics/toriamos/ribbonsundone.html,"She's a girl
Rising from a shell
Running to spring
It is her time it is her time
Watch her run with ribbons undone

She's a rose in a lily's cloak
She can hide her charms
It is her right there will be time
To chase the sun with ribbons undone

She runs like a fire does
Just picking up daises
Comes in for a landing
A pure flash of lightening
Past alice blue blossoms
You follow her laughter
And then she'll surprise you
Arms filled with lavender

Yes my little pony is growing up fast
She corrects me and says
""You mean a thoroughbred""
A look in her eyes says the battle's beginning
From school she comes home and cries
I don't want to grow up Mom at last not tonight

You're a girl
Rising from a shell
Running through spring
With summer's hand in reach now
It is your time
It is your time
So just run with ribbons undone
It is your time yes my angel
It is your time
So just run with ribbons undone

Run run darlin'
Ribbons undone",2005
Where Were You (When The World Stopped Turning),Alan Jackson,https://www.azlyrics.com/lyrics/alanjackson/wherewereyouwhentheworldstoppedturning.html,"Where were you when the world stopped turning on that September day?
Were you in the yard with your wife and children
Or working on some stage in L.A.?

Did you stand there in shock
At the sight of that black smoke
Risin' against that blue sky?
Did you shout out in anger
In fear for your neighbor
Or did you just sit down and cry?

Did you weep for the children who lost their dear loved ones
Pray for the ones who don't know?
Did you rejoice for the people who walked from the rubble
And sob for the ones left below?

Did you burst out with pride
For the red, white and blue
And the heroes who died
Just doin' what they do?

Did you look up to heaven for some kind of answer
And look at yourself and what really matters?

I'm just a singer of simple songs
I'm not a real political man
I watch CNN
But I'm not sure I can tell you
The difference in Iraq and Iran
But I know Jesus and I talk to God
And I remember this from when I was young
Faith, hope and love are some good things He gave us
And the greatest is love

Where were you when the world stopped turning on that September day?
Teaching a class full of innocent children
Or driving down some cold interstate?

Did you feel guilty
'Cause you're a survivor
In a crowded room did you feel alone?
Did you call up your mother
And tell her you loved her?
Did you dust off that Bible at home?

Did you open your eyes, hope it never happened
Close your eyes and not go to sleep?
Did you notice the sunset the first time in ages
Or speak to some stranger on the street?

Did you lay down at night and think of tomorrow
Go out and buy you a gun?
Did you turn off that violent old movie you're watchin'
And turn on ""I Love Lucy"" reruns?

Did you go to a church and hold hands with some strangers
Stand in line and give your own blood?
Did you just stay home and cling tight to your family
Thank God you had somebody to love?

I'm just a singer of simple songs
I'm not a real political man
I watch CNN
But I'm not sure I can tell you
The difference in Iraq and Iran
But I know Jesus and I talk to God
And I remember this from when I was young
Faith, hope and love are some good things He gave us
And the greatest is love

I'm just a singer of simple songs
I'm not a real political man
I watch CNN
But I'm not sure I can tell you
The difference in Iraq and Iran
But I know Jesus and I talk to God
And I remember this from when I was young
Faith, hope and love are some good things He gave us
And the greatest is love

And the greatest is love
And the greatest is love

Where were you when the world stopped turning on that September day?",2002
Without You Here,Goo Goo Dolls,https://www.azlyrics.com/lyrics/googoodolls/withoutyouhere.html,"Your love's a gathered storm I chased across the sky
A moment in your arms became the reason why
And you're still the only light that fills the emptiness
The only one I need until my dying breath
And I would give you everything just to
Feel your open arms
And I'm not sure I believe anything I feel

And now, now that you're near
There's nothing more without you 
Without you here

And I'm trying to believe
In things that I don't know
The turning of the world
The color of your soul
That love could kill the pain
Truth is never vain
It turns strangers into lovers
And enemies to brothers
Just say you understand
I never had this planned

And now, now that you're near 
There's nothing more without you 
Without you here
Without you here
There's nothing more without you 
Without you here

My head lies to my heart 
And my heart it still believes
It seems the ones who love us are the ones
That we deceive
But you're changing everything
You're changing everything in me

And now, now that you're near 
There's nothing more without you 
Without you here",2006
Break It Up,Scooter,https://www.azlyrics.com/lyrics/scooter/breakitup.html,"Where in the world, where in the world
Where in the world did I get this hurt
I don't mind, I don't mind
If you call me bad, call me wrong
Call me anything but your own
I don't mind, I don't mind

I don't care if you leave me
I don't care if you go away
I don't care if you wanted this
I don't mind

Break it up, break it up, break it up, break it up, my love
If you think that you can't stay with me then break it up my love
Break it up, just break it up, break it up, just break it up.

So where in the world, where in the world,
Where in the world can I hide this hurt,
I don't mind, I don't mind
If you call me sad, call me strong
Strong enough to make it on my own
'Cause I don't mind, I don't mind

If you tear down your walls inside
Go for a brand new ride
But babe please don't tell me so

Break it up, break it up, break it up, break it up, my love
If you think that you can't stay with me then break it up my love
Break it up, just break it up, break it up, just break it up.

Break it up, just break it up",1996
The Forgotten,Green Day,https://www.azlyrics.com/lyrics/greenday/theforgotten.html,"Where in the world’s the forgotten?
They’re lost inside your memory
You’re dragging on, your heart’s been broken
As we all go down in history

Where in the world did the time go?
It’s where your spirit seems to roam
Like losing faith to our abandon
Or an empty hallway from a broken home

Well don’t look away from the arms of a bad dream
Don’t look away, sometimes you’re better lost than to be seen

I don’t feel strange, it’s more like haunted
Another moment trapped in time
I can’t quite put my finger on it
But it’s like a child that was left behind

So where in the world’s the forgotten?
Like soldiers from a long lost war
We share the scars from our abandon
And what we remember becomes folklore

Well, don’t look away from the arms of a bad dream
Don’t look away, sometimes you’re better lost than to be seen
Don’t look away from the arms of a moment
Don’t look away from the arms of tomorrow
Don’t look away from the arms of a moment
Don’t look away from the arms of love

Well, don’t look away from the arms of a bad dream
Don’t look away, sometimes you’re better lost than to be seen
Don’t look away from the arms of a moment
Don’t look away from the arms of tomorrow
Don’t look away from the arms of a moment
Don’t look away from the arms of love",2012
