song,artist,url,lyrics,year
I'll Wait for You,Joe Nichols,https://www.azlyrics.com/lyrics/joenichols/illwaitforyou.html,"The snow in Montana was three feet high
Lady at the counter said,
""There ain't no flights""
So he called her on the telephone,
He said I'll rent a car
And I'll drive home.

She said,
I'll wait for you like I did last year
At Christmas time with you family here,
And your truck broke down
Out in San Antone
And the gifts stayed wrapped
Till you got home,
Oh this ain't nothing new,
Sweetheart I'll wait for you.

Now he's on his cell phone
In a Coupe deVille
Talking to the one he loves and always will
His heart is breaking
Cause she's there alone
Her heart is aching
Cause she wants him home

She says i'll wait for you
Like in '68 when our child was due
I said It will have to wait
Until his dad gets here,
And stands by my side,
Remember dear our son's first cry.
Soh this ain't nothing new,
Sweetheart I'll wait for you.

He didn't stop all day
To eat a bite,
And he finally got there around midnight
The doctor said she's in a better place
She said to give you this note,
Just in case.

And it said I'll wait for you
At heaven's gate,
Oh I don't care how long it takes
And I'll tell St. Pete I can't come in
Without my love and my best friend,
Oh this ain't nothing new,
Sweetheart I'll wait for you.

P.S. I love you too
Sweatheart I'll wait for you...",2005
He Stopped Loving Her Today,George Jones,https://www.azlyrics.com/lyrics/georgejones/hestoppedlovinghertoday.html,"He said, ""I'll love you till I die""
She told him, ""You'll forget in time""
As the years went slowly by
She still preyed upon his mind

He kept her picture on his wall
Went half-crazy, now and then
He still loved her through it all
Hoping she'd come back again

Kept some letters by his bed
Dated 1962
He had underlined in red
Every single 'I love you'

I went to see him just today
Oh, but I didn't see no tears
All dressed up to go away
First time I'd seen him smile in years

He stopped loving her today
They placed a wreath upon his door
And soon they'll carry him away
He stopped loving her today

You know, she came to see him one last time
Oh, and we all wondered if she would
And it kept running through my mind
This time he's over her for good

He stopped loving her today
They placed a wreath upon his door
And soon they'll carry him away
He stopped loving her today",1980
Years,Barbara Mandrell,https://www.azlyrics.com/lyrics/barbaramandrell/years.html,"Faded photographs
The feelings all come back
Even now sometimes
You feel so near
And I still see your face
Like it was yesterday
It's strange how the days turned into years

Years of hanging on
To dreams are already gone
Years of wishing you were here
After all this time you'd think I wouldn't cry
It's just that I still love you after all these years

Nighttime gently falls
Another day is gone
I turn around to find you're still not here
I leave the hall light on
In case you come back home
But I've been saying that for years

Years of hanging on
To dreams are already gone
It's of wishing you were here
After all this time you'd think I wouldn't cry
It's just that I still love you after all these years

After all these years...",1979
Days Like These,Janis Ian,https://www.azlyrics.com/lyrics/janisian/dayslikethese.html,"On days like these
When the rain won't fall
And the sky is so dry
That even birds can't call
I can feel your tears
Disappearing in the air
Carried on the breeze
On days like these

It's years like these
That make a young man old
Bend his back against the promises
That life should hold
They can make him wise
They can drive him to his knees
Nothing comes for free
On days like these

But you can't reap what you don't sow
And you can't plant in fallow ground
So let us fill this empty earth with hope
Until the rains come down

In lives like these
Where every moment counts
I add up all the things
That I can live without
When the one thing left
Is the blessing of my dreams
I can make my peace
With days like these

I can make my peace
With days like these",2000
The Sun Ain't Gonna Shine Anymore,The Walker Brothers,https://www.azlyrics.com/lyrics/walkerbrothers/thesunaintgonnashineanymore.html,"Loneliness
Is a cloak you wear
A deep shade of blue
Is always there

The sun ain't gonna shine anymore
The moon ain't gonna rise in the sky
The tears are always clouding your eyes
When you're without love, baby

Emptiness
Is a place you're in
With nothing to lose
But no more to win

The sun ain't gonna shine anymore
The moon ain't gonna rise in the sky
The tears are always clouding your eyes
When you're without love

Lonely
Without you baby
Girl I need you
I can't go on

The sun ain't gonna shine anymore
(The sun ain't gonna shine anymore)
The moon ain't gonna rise in the sky
(The moon ain't gonna rise in the sky)
The tears are always clouding your eyes
(The tears are always clouding your eyes)
The sun ain't gonna shine anymore
When you're without love, baby

(The sun ain't gonna shine anymore)
(The sun ain't gonna shine anymore)
(The sun ain't gonna shine anymore)
(The sun ain't gonna shine anymore)
(The sun ain't gonna shine anymore)",1966
Till It Happens to You,Corinne Bailey Rae,https://www.azlyrics.com/lyrics/corinnebaileyrae/tillithappenstoyou.html,"I know what I said
Was heat of the moment
But theres a little truth in between the words we've spoken
Its a little late now to fix the heart thats broken
Please don't ask me where I'm going
Cause I don't know
No I don't know anymore

It used to feel like heaven
Used to feel like may
I used to hear those violins playing heart strings like a symphony
Now they've gone away
Nobody wants to face the truth
But you wont believe what love can do
Till it happens to you
Till it happens to you

Went to the old flat
Guess I was trying to turn the clock back
How come that nothing feels the same now when I'm with you
We used to stay up all night in the kitchen
When our love was new
Oooh love I'm a fool to believe in you
Cause I don't know
No I don't know
Anymore

It used to feel like heaven
It used to feel like may
I used to hear those violins playing heart strings like a symphony
Now they've gone away
Nobody wants to know the truth
Until their hearts broken
Don't you dare tell them
What you think to do
Till they get over
You can only learn these things
From experience
When you get older
I just wish that someone would have told me
Till it happens to you
Till it happens to you
Till it happens to you",2006
Not Pretty Enough,Kasey Chambers,https://www.azlyrics.com/lyrics/kaseychambers/notprettyenough.html,"Am I not pretty enough
Is my heart too broken
Do I cry too much
Am I too outspoken

Don't I make you laugh
Should I try it harder
Why do you see right through me

I live, I breathe, I let it rain on me
I sleep, I wake, I try hard not to break
I crave, I love, I've waited long enough
I try as hard as I can

Am I not pretty enough
Is my heart too broken
Do I cry too much
Am I too outspoken

Don't I make you laugh
Should I try it harder
Why do you see right through me

I laugh, I feel, I make believe it's real
I fall, I freeze, I pray down on my knees
I hope, I stand, I take it like a man
I try as hard as I can

Am I not pretty enough
Is my heart too broken
Do I cry too much
Am I too outspoken

Don't I make you laugh
Should I try it harder
Why do you see right through me

Why do you see, why do you see
Why do you see right through me

Why do you see, why do you see
Why do you see right through me

Why do you see, why do you see
Why do you see right through me

Why do you see, why do you see
Why do you see right through me",2001
Six O'Clock News,Kathleen Edwards,https://www.azlyrics.com/lyrics/kathleenedwards/sixoclocknews.html,"Copper on the corner and he loaded two rounds
And I can't even get inside to talk you down
Peter, sweet baby, where'd you get that gun?
You spend half your life trying to turn the other half around

And I tried to come clean, but I guess it's no use
Your face is all over six o'clock news
They cleared the street and then they closed the schools
I can't even get inside

Did you lose your head when the farm went down?
Was is when your daddy died after he moved to town
And I know your momma calls you good for nothing
She says her baby is a failer and she don't want you calling

Peter, sweet baby, there's something I need to say to you
Gonna have your baby this coming June
We could get a little place down by Gilmour park
You could do a little time and save my broken heart

And I tried to come clean, but I guess it's no use
Copper when ahead and he just shot you through
Now you're lying dead on the avenue
And I can't feel my broken heart",2003
You Don't Even Know Who I Am,Patty Loveless,https://www.azlyrics.com/lyrics/pattyloveless/youdontevenknowwhoiam.html,"She left the car in the driveway
She left the key in the door
She left the kids at her mama's
And the laundry piled up on the floor
She left her ring on the pillow
Right where it wouldn't be missed
She left a note in the kitchen
Next to the grocery list

It said, you don't even know who I am
You left me a long time ago
You don't even know who I am
So what do you care if I go

He left the ring on the pillow
He left the clothes on the floor
And he called her to say he was sorry
But he couldn't remember what for
So he said I've been doing some thinking
I've been thinking that maybe you're right
I go to work every morning
And I come home to you every night

And you don't even know who I am
You left me a long time ago
You don't even know who I am
So what do I care if you go
You don't even know who I am
So what do I care if you go",1994
Tiny Cities Made of Ashes,Sun Kil Moon,https://www.azlyrics.com/lyrics/sunkilmoon/tinycitiesmadeofashes.html,"We're goin' down the road towards tiny cities made of ashes
Gonna hit you on the face gonna punch you in your
Glasses. Oh no!
Just got a message said ""Yeah hell is freezin' over""
I Got a phone call from the Lord sayin' ""boy go get a
Sweater. Right now""
So we're drinkin' drinkin' drinkin' drinkin' coca-coca-cola
I can feel it rollin' right on down
Right on down my throat
As we're headed down the road towards tiny cities
Made of ashes
Gonna get dressed up in plastic gonna shake hands
With the masses. Oh no!
Does anybody know a way that a body could get away
Does anybody know a way
Were goin' down the road towards tiny cities made of ashes
Gonna hit you on the face goin' to punch you in your
Glasses. Oh no!
I'm wearin' a t-shirt that says ""The world is my ashtray""
Our hearts pump dust and our hairs all grey
Just got a message sayin' yeah hell has frozen over
Got a phone call from the Lord sayin' ""boy go get a
Sweater. Right now!""
Does anybody know a way that a body could get away
Does anybody know a way
Were drinkin' drinkin' drinkin' drinkin' coca-coca-cola cola!
I can feel it rollin' right on down oh right on down my throat
And as we're headed down the road towards tiny cities
Made of ashes
I'm gonna lay down in the baths where they coat you
In molasses. Oh no!
Does anybody know a way that a body could get away
Does anybody know a way",2005
I Think It's Going to Rain Today,Bette Midler,https://www.azlyrics.com/lyrics/bettemidler/ithinkitsgoingtoraintoday.html,"Broken windows and empty hallways,
a pale lit moon in a sky streaked with grey.
Human kindness is overflowing,
and I think it's gonna rain today.

Scarecrows dressed in the latest styles,
the frozen smiles to chase love away.
Human kindness is overflowing,
and I think it's gonna rain today.

Lonely, lonely.
Tin can at my feet,
I think I'll kick it down the street.
That's the way to treat a friend.

Right before me the signs implore me:
Help the needy and show them the way.
Human kindness is overflowing,
and I think it's gonna rain today.

Lonely, so lonely.
Tin can at my feet,
I think I'll kick it down the street.
That's the way to treat a friend.

Right before me the signs implore me:
Help the needy and show them the way.
Human kindness is overflowing,
and I think it's gonna rain today.",ound
Unloveable,The Smiths,https://www.azlyrics.com/lyrics/smiths/unloveable.html,"Oh...
I know I'm unloveable
You don't have to tell me
I don't have much in my life
But take it - it's yours
I don't have much in my life
But take it - it's yours
Oh...

I know I'm unloveable
You don't have to tell me
Oh, message received
Loud and clear
Loud and clear
I don't have much in my life
But take it - it's yours

I know I'm unloveable
You don't have to tell me
For message received
Loud and clear
Loud and clear
Message received
I don't have much in my life
But take it - it's yours

I wear Black on the outside
'Cause Black is how I feel on the inside
I wear Black on the outside
'Cause Black is how I feel on the inside

And if I seem a little strange
Well, that's because I am
If I seem a little strange
That's because I am

But I know that you would like me
If only you could see me
If only you could meet me

Oh...
I don't have much in my life
But take it - it's yours
I don't have much in my life
But take it - it's yours
Mmm...
Oh...",ompi
The Point of It All,Amanda Palmer,https://www.azlyrics.com/lyrics/amandapalmer/thepointofitall.html,"Oh, what a noble, distinguished collection of fine little friends you have made
Hitting the tables without you again: no we'll wait, no we promise, we'll wait
June makes these excellent sewing machines out of common industrial waste
She spends a few days at a time on the couch but she says
She wears shades, she wears shades

But no one can stare at the wall as good as you, my baby-doll
And you're aces for coming along
You're almost human, after all
And you're learning that just 'cause they call themselves friends
Doesn't mean they'll call...

They made the comment in jest
But you've got the needle
I guess that's the point of it all

Maybe a week in the tropics would help to remind you how nice life can be
We propped you right up in a chair on a deck with a beautiful view of the sea
But a couple weeks later we came back and you and the chair were nowhere to be seen
You had magically moved to the closet
Eyes fixed to the place where the dryer had been

Oh, but no one can stare at the wall as good as you, my baby-doll
And you're aces for coming along
You're almost human, after all
Why on earth would I keep you propped up in here when you so love the fall...?

The pattern's laid out on the bed
With dozens of colors of thread
But you've got the needle
I guess that's the point in the end

But it's better to waste your day watching the scenery change at a comatose rate
Than to put yourself in it and turn into one of those cigarette ads that you hate
But while you were sleeping some men came around
Said they had some dimensions to take
I'm not sure what they were talking about but they sure made a mess of your face

But still, no one can stare at the wall as good as you, my baby-doll
And you're aces for playing along
You're almost human, even now

And just 'cause they call themselves experts
It doesn't mean sweet fuck all...
They've got the permanent press
Homes with a stable address

And they've got excitement
And life by the fistful
But you've got the needle
I guess that's the point of it all",2008
Perfect Enemy,t.A.T.u.,https://www.azlyrics.com/lyrics/tatu/perfectenemy.html,"Why should I welcome
Your domination
Why should I listen
To explanations
I'm not pretending
To make it simple
Try to be something
Experimental
You don't turn me off
I will never fail
Things I loved before,
are now for sale
Keep yourself away
Far away from me
I'll Forever stay
Your perfect enemy

No longer waiting
Remove illusions
No more complaining
Forget confusion
No more compassion
Not sentimental
I am now something
Experimental
You don't turn me off
I will never fail
Things I loved before,
are now for sale
Keep yourself away
Far away from me
I'll Forever stay
Your perfect enemy",2005
The Rose,Bette Midler,https://www.azlyrics.com/lyrics/bettemidler/therose.html,"Some say, ""Love. It is a river
That drowns the tender reed""
Some say, ""Love. It is a razor
That leaves your soul to bleed""
Some say, ""Love. It is a hunger
An endless aching need""
I say, ""Love. It is a flower
And you its only seed""

It's the heart afraid of breaking
That never learns to dance
It's the dream afraid of waking
That never takes the chance
It's the one who won't be taken
Who cannot seem to give
And the soul afraid of dyin'
That never learns to live

When the night has been too lonely
And the road has been too long
And you think that love is only
For the lucky and the strong
Just remember in the winter
Far beneath the bitter snow
Lies the seed that with the sun's love
In the spring becomes the rose",ound
Born in the USA,Bruce Springsteen,https://www.azlyrics.com/lyrics/brucespringsteen/bornintheusa.html,"Born down in a dead man's town
The first kick I took was when I hit the ground
You end up like a dog that's been beat too much
Till you spend half your life just covering up

Born in the U.S.A.
I was born in the U.S.A.
I was born in the U.S.A.
Born in the U.S.A.

Got in a little hometown jam
So they put a rifle in my hand
Sent me off to a foreign land
To go and kill the yellow man

Born in the U.S.A.
I was born in the U.S.A.
I was born in the U.S.A.
I was born in the U.S.A.
Born in the U.S.A.

Come back home to the refinery
Hiring man says ""Son if it was up to me""
Went down to see my V.A. man
He said ""Son, don't you understand""

I had a brother at Khe Sanh fighting off the Viet Cong
They're still there, he's all gone

He had a woman he loved in Saigon
I got a picture of him in her arms now

Down in the shadow of the penitentiary
Out by the gas fires of the refinery
I'm ten years burning down the road
Nowhere to run ain't got nowhere to go

Born in the U.S.A.
I was born in the U.S.A.
Born in the U.S.A.
I'm a long gone Daddy in the U.S.A.
Born in the U.S.A.
Born in the U.S.A.
Born in the U.S.A.
I'm a cool rocking Daddy in the U.S.A.",1984
Against All Odds (Take a Look at Me Now),Phil Collins,https://www.azlyrics.com/lyrics/philcollins/againstalloddstakealookatmenow.html,"How can I just let you walk away, just let you leave without a trace
When I stand here taking every breath with you, ooh
You're the only one who really knew me at all

How can you just walk away from me,
When all I can do is watch you leave
Cause we've shared the laughter and the pain and even shared the tears
You're the only one who really knew me at all

So take a look at me now, oh there's just an empty space
And there's nothing left here to remind me,
Just the memory of your face
Ooh take a look at me now, well there's just an empty space
And you coming back to me is against the odds and that's what I've got to face

I wish I could just make you turn around,
Turn around and see me cry
There's so much I need to say to you,
So many reasons why
You're the only one who really knew me at all

So take a look at me now, well there's just an empty space
And there's nothing left here to remind me, just the memory of your face
Now take a look at me now, cause there's just an empty space

But to wait for you, is all I can do and that's what I've got to face
Take a good look at me now, cause I'll still be standing here
And you coming back to me is against all odds
It's the chance I've gotta take

Take a look at me now",
Sylvia's Mother,Dr. Hook,https://www.azlyrics.com/lyrics/drhook/sylviasmother.html,"Sylvia's mother says, 'Sylvia's busy
Too busy to come to the phone'
Sylvia's mother says, 'Sylvia's tryin'
To start a new life of her own'
Sylvia's mother says, 'Sylvia's happy
So why don't you leave her alone?'

And the operator says, '40 cents more for the next 3 minutes'
Please Mrs. Avery, I just gotta talk to her
I'll only keep her a while
Please Mrs. Avery, I just wanna tell 'er goodbye

Sylvia's mother says, 'Sylvia's packin'
She's gonna be leavin' today'
Sylvia's mother says, 'Sylvia's marryin'
A fella down Galveston way'
Sylvia's mother says, 'Please don't say nothin'
To make her start cryin' and stay'

And the operator says, '40 cents more for the next 3 minutes'
Please Mrs. Avery, I just gotta talk to her
I'll only keep her a while
Please Mrs. Avery, I just wanna tell 'er goodbye

Sylvia's mother says, 'Sylvia's hurryin'
She's catchin' the nine o'clock train'
Sylvia's mother says, 'Take your umbrella
Cause Sylvie, it's startin' to rain'
And Sylvia's mother says, 'Thank you for callin'
And, sir, won't you call back again?'

And the operator says, '40 cents more for the next 3 minutes'
Please Mrs. Avery, I just gotta talk to her
I'll only keep her a while
Please Mrs. Avery, I just wanna tell 'er goodbye

Tell her goodbye

Please
Tell her goodbye",1971
The Most Beautiful Girl,Charlie Rich,https://www.azlyrics.com/lyrics/charlierich/themostbeautifulgirl.html,"Hey, did you happen to see the most beautiful girl in the world?
And if you did was she cryin', cryin'?

Hey, if you happen to see the most beautiful girl that walked out on me
Tell her I'm sorry
Tell her I need my baby
Oh, won't you tell her that I love her?

I woke up this morning
Realized what I had done
I stood alone in the cold gray dawn
I knew I'd lost my morning sun

I lost my head and I said some things
Now comes the heartaches that morning brings
I know I'm wrong and I couldn't see
I let my world slip away from me

So, hey, did you happen to see the most beautiful girl in the world?
And if you did was she cryin', cryin'?

Hey, if you happen to see the most beautiful girl that walked out on me
Tell her I'm sorry
Tell her I need my baby
Oh, won't you tell her that I love her?

If you happen to see the most beautiful girl that walked out on me
Tell her I'm sorry
Tell her I need my baby
Oh, won't you tell her that I love her?",1973
Second Chance,Shinedown,https://www.azlyrics.com/lyrics/shinedown/secondchance.html,"My eyes are open wide
By the way
I made it through the day
I watched the world outside
By the way
I'm leaving out today

I just saw Halley's comet
She waved
Said, ""Why you always running in place?""
Even the man in the moon disappeared
Somewhere in the stratosphere

Tell my mother
Tell my father
I've done the best I can
To make them realize
This is my life
I hope they understand
I'm not angry, I'm just saying
Sometimes goodbye is a second chance

Please don't cry one tear for me
I'm not afraid
Of what I have to say
This is my one and only voice
So listen close
It's only for today

I just saw Halley's comet
She waved
Said, ""Why you always running in place?""
Even the man in the moon disappeared
Somewhere in the stratosphere

Tell my mother
Tell my father
I've done the best I can
To make them realize
This is my life
I hope they understand
I'm not angry, I'm just saying
Sometimes goodbye is a second chance

Here's my chance
This is my chance

Tell my mother
Tell my father
I've done the best I can
To make them realize
This is my life
I hope they understand
I'm not angry, I'm just saying
Sometimes goodbye is a second chance

Sometimes goodbye is a second chance
Sometimes goodbye is a second chance",2008
What About Now,Daughtry,https://www.azlyrics.com/lyrics/daughtry/whataboutnow.html,"Shadows fill an empty heart
As love is fading
From all the things that we are
But are not saying
Can we see beyond the stars
And make it to the dawn?

Change the colors of the sky
And open up to
The ways you made me feel alive
The ways I loved you
For all the things that never died
To make it through the night
Love will find you

What about now?
What about today?
What if you're making me all that I was meant to be?
What if our love never went away?
What if it's lost behind words we could never find?
Baby, before it's too late
What about now?

The sun is breaking in your eyes
To start a new day
This broken heart can still survive
With a touch of your grace
Shadows fade into the light
I am by your side
Where love will find you

What about now?
What about today?
What if you're making me all that I was meant to be?
What if our love, it never went away?
What if it's lost behind words we could never find?
Baby, before it's too late
What about now?

Now that we're here
Now that we've come this far
Just hold on
There is nothing to fear
For I am right beside you
For all my life
I am yours

What about now?
What about today?
What if you're making me all that I was meant to be?
What if our love never went away?
What if it's lost behind words we could never find?

What about now?
What about today?
What if you're making me all that I was meant to be?
What if our love never went away?
What if it's lost behind words we could never find?
Baby, before it's too late
Baby, before it's too late
Baby, before it's too late
What about now?",2006
This Boy,The Beatles,https://www.azlyrics.com/lyrics/beatles/thisboy.html,"That boy took my love away
Though he'll regret it someday
But this boy wants you back again

That boy isn't good for you
Though he may want you too
This boy wants you back again

Oh, and this boy would be happy
Just to love you, but oh my
That boy won't be happy
Till he's seen you cry

This boy wouldn't mind the pain
Would always feel the same
If this boy gets you back again

This boy
This boy
This boy [fade out]",1988
