song,artist,url,lyrics,year
Maid Of Bond Street,David Bowie,https://www.azlyrics.com/lyrics/davidbowie/maidofbondstreet.html,"This girl is made of lipstick
Powder and paint
Sees the picture of herself
Every magazine on every shelf
This girl is maid of bond street
Hailing cabs, lunches with executives
Gleaming teeth sip aperitifs
This girl is a lonely girl
Takes the train from Paddington to Oxford Circus
Buys the Daily News
But passengers don't smile at her, don't smile at her
This girl is made of loneliness
A broken heart
For the boy she once knew
Doesn't want to know her any more
And this girl is a lonely girl
Everything she wants is hers
But she can't make it with the boy she really wants to be with
All the time, to love, all the time 
This boy is made of envy
Jealousy
He doesn't have a limousine
Really wants to be a star himself
This girl, her world is made of flashlights and films 

Her cares are scraps on the cutting room floor

And maids of bond street drive round in chauffered cars
Maids of Bond street picture clothes, eyes of star 
Maids of Bond street shouldn't have worldly cares

Maids of Bond street shouldn't have love affairs",1967
Fewer Words,Badly Drawn Boy,https://www.azlyrics.com/lyrics/badlydrawnboy/fewerwords.html,"Bet you wish you knew what time it is
And it's clear that you don't
Understand a love that requires fewer words
It's been a while since we spoke
But there's still hope
If we materialise the myth
Never trivialise the kiss
Oh it feels like there's no fire left in your eyes
This is how love dies
This is how love dies",2004
Andalucia,Yo La Tengo,https://www.azlyrics.com/lyrics/yolatengo/andalucia.html,"Andalucia when can I see you
When it is snowing out again
Farmer John wants you
Louder and softer closer and dearer
Then again
Needing you taking you keeping you leaving you
In a year and a day to be sure
That your face doesn't alter
Your words never falter - I love you

Ill be here waiting later and later
Hoping the night will go away
Andalucia castles and christians
Andalucia come to stay
You were lost, once before, on a day much like this
When you'd made up your mind not to come
And I couldn't persuade you
Or wait till tomorrow - or pass the time",1990
Never Went to Church,The Streets,https://www.azlyrics.com/lyrics/streets/neverwenttochurch.html,"Two great European narcotics,
Alcohol and Christianity,
I know which one I prefer

We never went to church,
Just get on with work and sometimes things'll hurt,
But it's hit me since you left us,
And it's so hard not to search.

If you were still about,
I'd ask you what I'm supposed to do now,
I just get a bit scared,
Every now,
Hope I made you proud.

On your birthday when mom passed the forks and spoons,
I put my head on the table I was so distraught with you,
You tidied your things into the bin,
The more poorly you grew,
So there's nothing of yours to hold or to talk to.

Put your hand up and interrupt the conversation with a, but..
People say I interrupt people with the same look.
Sometimes I think so hard I can't remember how your face looked,
Started reading about dreams in your favourite book.
Panic and pace when I can't see the right thing to do.
You'd be scratching your head through the best advice you knew.
And I feel sad I can't hear you reciting it through,
I miss you dad but I've got nothing to remind me of you

[Chorus]

I needed a break when your book about dreams was taken,
I needed to pray or see a priest that day,
I needed to leave this trade and just heave it away.
But I cleaned up my place like you so I could see things straight.

I never cared about God when life was sailin' in the calm,
So I said I'd get my head down and I'd deal with the ache in my heart,
And for that if God exists I'd reckon he'd pay me regard,
Mom says me and you are the same from the start.

I guess than you did leave me something to remind me of you,
Everytime I interrupt someone like you used to,
When I do something like you you'll be on my mind or through,
'Cause I forgot you left me behind to remind me of you.

[Chorus x2]

But you you still tell me how you didn't know what to do even now,
And then I'm not so scared somehow,
'Cause I know that you'd be proud.

I got a good one for you dad,
I'm gonna see a priest, a Rabbi and a Protestant clergyman,
You always said I should hedge my bets.",2006
Lonely,Tom Waits,https://www.azlyrics.com/lyrics/tomwaits/lonely.html,"Lonely, lonely, lonely, lonely eyes, lonely face, lonely lonely in your place.
Lonely, lonely, lonely eyes, lonely face, lonely lonely in your place.

I thought that I knew all that there was to, lonely, lonely, lonely...

Melanie Jane, won't feel the pain.
Lonely, lonely, lonely eyes, lonely eyes, lonely lonely in your place.

And I thought that I knew all that there was to
Lonely, lonely, lonely eyes, lonely eyes, lonely lonely in your place, and
I still love you, I still love you, lonely, lonely...",1973
Beautiful Boy (Darling Boy),John Lennon,https://www.azlyrics.com/lyrics/johnlennon/beautifulboydarlingboy.html,"Close your eyes,
Have no fear,
The monster's gone,
He's on the run
And your daddy's here,

[2x]
Beautiful, beautiful, beautiful,
Beautiful boy,

Before you go to sleep,
Say a little prayer,
Every day
In every way,
It's getting better and better,

[2x]
Beautiful, beautiful, beautiful,
Beautiful boy,

Out on the ocean sailing away,
I can hardly wait
To see you to come of age,
But I guess we'll both
Just have to be patient,

'Cause it's a long way to go,
A hard row to hoe
Yes, it's a long way to go
But in the meantime,

Before you cross the street,
Take my hand,
Life is what happens to you,
While you're busy making other plans,

[2x]
Beautiful, beautiful, beautiful,
Beautiful boy,

Before you go to sleep,
Say a little prayer,
Every day
In every way,
It's getting better and better,

[2x]
Beautiful, beautiful, beautiful,
Beautiful boy,

Darling, darling,
Darling Sean.",1980
Drowned World/Substitute for Love,Madonna,https://www.azlyrics.com/lyrics/madonna/drownedworldsubstituteforlove.html,"I traded fame for love
Without a second thought
It all became a silly a game
Some things cannot be bought

I got exactly what I asked for
Wanted it so badly
Running, rushing back for more
I suffered fools so gladly

And now I find
I've changed my mind

[Chorus:]

The face of you
My substitute for love
My substitute for love
Should I wait for you
My substitute for love
My substitute for love

I traveled round the world
Looking for a home
I found myself in crowded rooms
Feeling so alone

I had so many lovers
Who settled for the thrill
Of basking in my spotlight
I never felt so happy

[chorus]

Mmmmm, ooohhh, mmmmm
Famous faces, far off places
Trinkets I can buy
No handsome stranger, heady danger
Drug that I can try
No ferris wheel, no heart to steal
No laughter in the dark
No one-night stand, no far-off land
No fire that I can spark
Mmmmm, mmmmm

[chorus]

Now I find I've changed my mind
This is my religion",1998
The Next Time You Say Forever,Neko Case,https://www.azlyrics.com/lyrics/nekocase/thenexttimeyousayforever.html,"I hear the tiniest sparks in the tenderest sound. 
Diving music, drowning the sound. 
waltzing with the hairs upon my arms. 
And your fire flood alarm, and you tremble, and you stumble, and you scrape up your palms. 
I can't stay here to hold your hand. 
I've been away for so long. 
I've lost my taste for home, and that's a dirty fallow feeling.
To be the dangling ceiling. 
From the roof came crashing down. 
Peeling in the heat.
Vanish in the rain.
The next time you say forever, I'll punch you in your face. 
Just because you don't believe it, doesn't mean I didn't mean it.
You never know when I'll show you the never.
You never know when I'll show you the never.",2009
Railroad Man,Eels,https://www.azlyrics.com/lyrics/eels/railroadman.html,"Feel like an old railroad man
Ridin' out on the bluemont line
Hummin' along old dominion blues
Not much to see and not much left to lose
And i know i can walk along the tracks
It may take a little longer but i'll know
How to find my way back

I feel like an old railroad man
Who's really tried the best that he can
To make his life add up to something good
But this engine no longer burns on wood
And i guess i may never understand
The times that i live in
Are not made for a railroad man

I feel like an old railroad man
Getting on board at the end of an age
The station's empty and the whistle blows
Things are faster now
And this train is just too slow
And i know i can walk along the tracks
It may take a little longer but i'll know
How to find my way back",2005
The Wait,Built to Spill,https://www.azlyrics.com/lyrics/builttospill/thewait.html,"You wait
You wait
You wait for summer
Then you wait for rain

You wait
You wait
You wait for darkness
Then you wait for day

Yeah, you wait
You wait, you wait
And she says patience, darling
Patience, patience, it will come

You wait
You wait
You wait for August
Then you wait for May

You wait
You wait
You wait to get up
Then you wait to play

You wait
You wait
You wait for something
That'll make the waiting worth the wait

You wait
You wait
And she says patience, darling
Patience, patience, it will come",2006
Don't Take Your Love Away,Vast,https://www.azlyrics.com/lyrics/vast/donttakeyourloveaway.html,"I am looking for inspiration
And I think I found it in your heart
It's the kind of thing you get when you're not looking
It's the kind of thing you had from the start

Put me on a ship that is sinking
On a voyage to an untamed land
Take away the freedoms I wanted
I understand

Please, don't take your love away from me
Don't take your love away from me
Please, don't take your love away from me

Please, don't take your love from me
Please, don't take your love from me

Put me inside flesh that is dying
A ghost that wanders without rest
Buried by desires and weakness
I understand

Please, don't take your love away from me
Don't take your love away from me

Please, don't take your love from me
Please, don't take your love from me",2004
The Idol,W.A.S.P.,https://www.azlyrics.com/lyrics/wasp/theidol.html,"Will I be alone this morning
Will I need my friends
Something just to ease away the pain
And now I never see the loneliness
Behind my face
I am just a prisoner to my faith

If I could only stand and stare in the mirror could I see
One fallen hero with a face like me?
And if I scream, could anybody hear me?
If I smash the silence, you'll see what fame has done to me

Kiss away the pain and leave me lonely
I'll never know if love's a lie
Ooh - being crazy in paradise is easy
Do you see the prisoners in my eyes?

Where's the love to shelter me
Give me love, come set me free
Where's the love, to shelter me
Only love, love set me free
Set me free

[Solo]

Kiss away the pain and leave me lonely
I'll never know if love's a lie
Ooh - being crazy in paradise is easy
Do you see the prisoners in my eyes?

Where's the love to shelter me
Give me love, come set me free
Where's the love, to shelter me
Only love, love set me free
Set me free",1992
The Drop,Peter Gabriel,https://www.azlyrics.com/lyrics/petergabriel/thedrop.html,"moving down the fuselage 
toward the open door 
catch you looking down outside 
to see what lies ahead 

one by one 
you watch them fall 
fall through cloud 
one by one 
you watch them fall 
no idea where they're going 
but down 

where they've gone 
where they've gone 

watching as the sun goes down 
i sit inside this plane 
notice how the city lights 
are like the nerves inside the brain 

one by one 
they're going out 
you watch them dim 

one by one 

you watch them fall 
and wonder where they're falling to",2002
Waltz #2 (XO),Elliott Smith,https://www.azlyrics.com/lyrics/elliottsmith/waltz2xo.html,"First the mic, then a half cigarette
Singing Kathy's clown
That's the man she's married to now
That's the girl that he takes around town
She appears composed
So she is, I suppose
Who can really tell?
She shows no emotion at all
Stares into space like a dead china doll

I'm never gonna know you now but I'm gonna love you anyhow

Now she's done, and they're calling someone
Such a familiar name
I'm so glad that my memory's remote
'Cause I'm doing just fine hour to hour, note to note
Here it is, the revenge to the tune
You're no good, you're no good, you're no good, you're no good
Can't you tell that it's well understood?

I'm never gonna know you now but I'm gonna love you anyhow

I'm here today, expect it to stay on, and on, and on
I'm tired, I'm tired
Looking out on the substitute scene
Still going strong
XO Mom
It's OK, it's alright, nothing's wrong
Tell Mr. Man with impossible plans
To just leave me alone
In the place where I make no mistakes
In the place where I have what it takes

I'm never gonna know you now but I'm gonna love you anyhow
I'm never gonna know you now but I'm gonna love you anyhow
I'm never gonna know you now but I'm gonna love you anyhow",1998
Long Life,Primal Scream,https://www.azlyrics.com/lyrics/primalscream/longlife.html,"Live life, live a long life, feel fine in the sunshine
Alive, alive, good to be alive, ah

Girl, I love to see you, sunshine, whenever I see you
Alive, alive, alive, good to be alive, ah",1997
With My Eyes Closed,The Raveonettes,https://www.azlyrics.com/lyrics/raveonettes/withmyeyesclosed.html,"I close my eyes
To hurt you
To live you
I never told you
That I
Could stay

It was never meant to
Be
For me

Everyone surely will tell you
That I will
Need you
But I don't believe you

Cause I've never had it
The way im
Supposed to

Believe me when I say

It was never meant to
Be
For me

Everyone surely will tell you
That I will
Need you
But I dont believe you

I close my eyes
To hurt you
To live you

I've never told you
That I
Could stay

It was never meant to
Be
For me",2008
These Streets,Paolo Nutini,https://www.azlyrics.com/lyrics/paolonutini/thesestreets.html,"Cross the border
Into the big bad world
Where it takes you 'bout an hour
Just to cross the road
Just to stumble across another poor old soul 
from the dreary old lanes to the high-street madness
I fight with my brain to believe my eyes
And it's harder than you think to delay this sadness
That creeps up my spine
And haunts me through the night

Life is good and the girls are gorgeous
Suddenly the air smells much greener now
And I'm wandering around
With a half pack of cigarettes
Searching for the change that I've lost somehow

These streets have too many names for me
I'm used to Glenfield Road and spending my time down in Orchy
I'll get used to this eventually
I know, I know

Where'd the days go? When all we did was play
And the stress that we were under wasn't stress at all
Just a run and a jump into a harmless fall from
Walking by a high-rise to a landmark square
You see millions of people with millions of cares
And I struggle to the train to make my way home
I look at the people as they sit there alone

Life is good, and the sun is shining
Everybody floods to their ideal place
And the children all smile as the boats shuffle by them
Trying to pretend that they've got some space

These streets have too many names for me
I'm used to Glenfield Road and spending my time down in Orchy
I'll get used to this eventually
I know, I know

These streets have too many names for me
I'm used to Glenfield Road and spending my time down in Orchy
I'll get used to this eventually
I know, I know

Life is good, and the girls are gorgeous
Suddenly the air smells much greener now
And I'm wandering around
With a half pack of cigarettes
Searching for the change that I've lost somehow

These streets have too many names for me
I'm used to Glenfield Road and spending my time down in Orchy
I'll get used to this eventually
I know, I know

These streets have too many names for me
I'm used to Glenfield Road and spending my time down in Orchy
I'll get used to this eventually
I know, I know
I know
I know",2006
Violence,blink-182,https://www.azlyrics.com/lyrics/blink182/violence.html,"Six bottles went down the drain
One hour's a waste of time
I'd ask if you feel the same
Still pushing that chance to try
Your breath in this cool room chill
Long hair that blows side to side
You speak and make time stand still
And each time you walk right on by

Like violence you have me, forever, and after
Like violence you kill me, forever and after

Can't count all the eyes that stare
Can't count all the things they see
She kills with no life to spare
Just victims are left to bleed
One drink and the pain goes down
Soft shadows lay by her feet
Lay soft as you slowly drown
Lay still while you fall asleep. (Fall asleep)

Like violence you have me, forever, and after
Like violence you kill me, forever and after
(And afterâ¦and afterâ¦and after)

Like violence you have me, forever, and after
Like violence you kill meâ¦
Like violence you have me, forever, and after
Like violence you kill meâ¦

Like violence you have me, forever, and after
Like violence you kill me, forever and after
Like violence you have me, forever, and after
Like violence you kill me, forever and after

[Lady's voice:]
My dearest
I've missed you very very much since that last night we were together
And will hold that night especially in my memories for years to come
I've been turning it over and over in my mind lately
I've read your letter through at least 4 times
And will probably read it more times before I'm through
I've been sitting here
Looking at your picture and getting more homesick every minute
I've wanted that picture more than anything else I know of
Except of course you, yourself
I keep thinking of you darling
I keep wishing I could be home with you
I want to leave in the worst possible way
So I could come home to see you
But things don't look too good on that subject
This war has spoiled a lot of things for everyone I guess
I've never been so lonesome in my life as I am right now
I'm completely lost without you darling
I never realized I could miss any one person so much
I just hope it won't be too much longer 'til I'm able to be with you again
And live a sane and normal life",2003
Soco Amaretto Lime,Brand New,https://www.azlyrics.com/lyrics/brandnew/socoamarettolime.html,"Passed out on the overpass 
Sunday best and broken glass 
Broken down from the bikes and bars 
Suspended like spirits over speeding cars 
You and me were kings over the parkway tonight 
And tonight will go on forever while we 
walk around this town like we own the streets 
and stay awake through summer like we own the heat 
Singing ""everybody wake up (wake up) it's time to get down"" 
(everybody, everybody wake up its time to get down) 
And when I pass the bottle back to Pete 
on the overpass tonight, I bet we laugh 

I'm gonna stay eighteen forever (cut me open) 
So we can stay like this forever (sun poisoned) 
And we'll never miss a party (this offer...)
cause we keep them going constantly (...stands forever)
And we'll never have to listen (new haircut) 
to anyone about anything (new bracelet) 
cause it's all been done and it's all been said (eyeliner) 
we're the coolest kids and we take what we can get

The hell out of this town 
Find some conversation 
The low fuel lights been on for days 
It doesn't mean anything 
I've got another 500, 'nother 500 miles 
before we shut this engine down, 
we shut it down 

I'm gonna stay eighteen forever (cut me open) 
So we can stay like this forever (sun poisoned) 
And we'll never miss a party (this offer...)
cause we keep them going constantly (...stands forever)
And we'll never have to listen (new haircut) 
to anyone about anything (new bracelet) 
cause it's all been done and it's all been said (eyeliner) 
we're the coolest kids and we take what we can get (wait forever) 

(you're just jealous cause I'm young and in love) 
Eighteen forever (first kisses)
(your stomach's filled up but you're starved for conversation) 
So we can stay like this forever (new stitches)
(you're spending all your nights growing old in your bed) 
And we'll never miss a party (collar weekend)
(and your tearin up your photos cause you wanna forget... it's over) 
cause we keep them going constantly (appearance ticket)
(you're just jealous cause I'm young and in love) 
And we'll never have to listen (November to...)
(your stomach's filled up but you're starved for conversation) 
to anyone about anything cause it's all been done (...remember)
(you're spending all your nights growing old in your bed) 
and it's all been said (nightswimmers)
(and your tearin up your photos cause you wanna forget... it's over) 
we're the coolest kids and we take what we can get 

Just jealous cause we're young and in love 
You're just jealous cause we're young and in love 
You're just jealous cause we're young and in love 
You're just jealous cause we're young and in love 
You're just jealous cause we're young and in love 
You're just jealous... [turntable scratch]",2001
Little Fat Baby,Sparklehorse,https://www.azlyrics.com/lyrics/sparklehorse/littlefatbaby.html,"Did you save your wisdom teeth?
Did you burn your Christmas tree?

He got dragged by a donkey
Through the dirt and the myrtle
But he was once a little fat baby

Did you lose your fatty in the bath?
Did you make the city slickers laugh?

He got dragged by a donkey
Through the glass and the myrtle
But he was once a little fat baby

Did you burn your wisdom teeth?
Did you save your Christmas tree?

He got dragged by a donkey
Through the switches and the myrtle
But he was once a little fat baby",2001
I Chose Horses,Mogwai,https://www.azlyrics.com/lyrics/mogwai/ichosehorses.html,"[Romanization:]
Mugen ni hirogaru
Ishiki no fuchi wo aruki
Kodou dake wo tayori ni
Kimi ni mukau toki
Hirakareta ao wa towa no kanousei wo utsushi
Kimi to boku no kawasu kotoba wo tsunageru
Omoku taresagaru yuuutsu no katachi wo omoiukabe
Soko ni aru hazu no kokoro
Yagate souon ni kakikesare
Oowarete hikari ni kaeri
Modoru koto wo nozomu koe wa hashiru
Shizuka ni tomaru shiroi nami
Minamo de haneru
Kumo no utagoe
Kuruu hizashi ni yakusoku no moji
Ashimoto ni hirogaru
Shikou no kakera wo mitsume
Kanawanu mono ni kibo no namida
Hoshi wa dare no mono ni
Kanashimi no saigo wa itsuka
Bokura ni kaesareru monogatari wa tsuzuku
Kage ni utsuru hitomi ni
Takusan no hohoemi wa musuu ni narabu
Deguchi e no shisen
Saiai no fuukei
Maboroshi ga motarasu
Shiroi shunkan to te no hira
Subete hohaba no naka ni sonzaishi
Afureru mizu ni touchaku no kane
Sora no hashi to yuuyami no kensou
Yoru wo koete
Chinmoku no toki
Tomoshibi keshite
Tsukiyo no michi wo
Muku na egao ni mikan no shiawase wo

[Translation:]
It stretches on forever
I walk through this abyss of consciousness
Relying only on my heartbeat when I face you
The open blue reflecting eternal possibility
The words we exchange intertwine
A melancholy figure, hanging heavily
Surfaces in my mind
There must be a heart there
Soon noise will drown it out
Returning to the concealed light
My voice raised, yearning to go back
White waves stop quietly
The song of the clouds breaking the surface
Letters of promise to the insane sunlight
I gaze at the fragments of thought spread out at my feet
Tears of hope for those unfulfilled
To whom do the stars belong?
Someday this sadness' end
Will be returned to us and the story will continue
Silhouettes reflected in my eyes
Countless faint smiles lined up before me
Gazing towards the exit
This beloved landscape
A vision brings
An instant of whiteness and the palm of my hand
All exists within one stride
Bells sound the arrival of the flood
The bridge of the sky and the clamour of twilight
I pass through this night in silence
I extinguish my lamp and in the moonlit street
Give an innocent smile for the happiness to come",2006
